PharmacoEconomics Open;PharmacoEconomics Open Pharmacoeconomics and Health Outcomes;PharmacoEconomics Open is an online openaccess journal for the publication of applied research on the economic implications and health outcomes associated with drugs devices and other healthcare interventions PharmacoEconomics Open focuses on original research and definitive reviews applying sound health economics and outcomes research methods to inform optimal healthcare policy and practice PharmacoEconomics Open offers a range of additional features designed to increase the visibility readership and educational value of the journals content Each article is accompanied by a Key Points summary giving a timeefficient overview of the content to a wide readership Articles may be accompanied by plain language summaries to assist readers who have some knowledge of but not indepth expertise in the area to understand the scientific content and overall implications of the article The journal also provides the option to include various types of digital features including animated abstracts video abstracts slide decks audio slides instructional videos infographics podcasts and animations All additional features are peer reviewed to the same high standard as the article itself Peer review is conducted using Editorial Manager supported by a database of international experts This database is shared with other Adis journals Manuscripts submitted to the journal for publication will be subject to an article processing charge APC upon acceptance Please click on the Fees and funding link for details of the current APC and open access funding and support services Adis Open Access enables you to make your journal article freely available to anyone in exchange for payment of the APC This option allows you the author to retain the copyright of the article according to the terms of the Creative Commons Attribution NonCommercial CC BYNC License which does not permit commercial reuse of the article The journal will consider fee discounts for developing countries and this is decided on a case by case basis Focuses on the economic implications associated with drugs medical devices etc Features topics such as analysis of healthcare interventions health outcomes and more Accommodates additional digital features such as video abstracts infographics etc
PharmacoEconomics German Research Articles;PharmacoEconomics German Research Articles Pharmacy;
PharmacoEconomics Italian Research Articles;PharmacoEconomics Italian Research Articles Pharmacy;
PharmacoEconomics Spanish Research Articles;PharmacoEconomics Spanish Research Articles Pharmacy;
Pharmacological Reports;Pharmacological Reports Pharmacy Drug Safety and Pharmacovigilance Pharmacotherapy;Pharmacological Reports is the official journal of Maj Institute of Pharmacology Polish Academy of Sciences Pharmacological Reports is an open forum for recent developments in experimental and clinical pharmacology dealing with the action of drugs at cellular molecular and behavioral levels It publishes research articles reviews and short communications The journal guarantees rapid publication of accepted papers comprised of fast acceptance and publication for articles It is a hybrid journal offering the choice of open access and is published bimonthly
Phenomenology and the Cognitive Sciences;Phenomenology and the Cognitive Sciences Phenomenology Philosophy of Mind Cognitive Psychology;Phenomenology and the Cognitive Sciences is an international journal that offers a forum for illuminating the intersections between phenomenology empirical science and analytic philosophy of mind The journal builds bridges between continental phenomenological approaches in the Husserlian tradition and disciplines that have not always been open to or aware of phenomenological contributions to understanding cognition and related topics The journal presents work by phenomenologists scientists and philosophers who study cognition In addition the journal offers discussion of methodological issues involving the variety of approaches appropriate for addressing these problems Phenomenology and the Cognitive Sciences provides critical review articles that address recent work in areas relevant to the connection between empirical results in experimental science and firstperson perspective A forum for illuminating the intersections between phenomenology empirical science and analytic philosophy of mind Builds bridges between the Husserlian tradition and other disciplines Addresses recent work on the connection between empirical results in experimental science and firstperson perspective
Phenomics;Phenomics Biomedicine general Human Genetics Biomedical EngineeringBiotechnology Genetics and Genomics;Phenomics is a new hybrid journal focusing on cuttingedge scientific advances in the emerging field of phenomics The dedicated editorial team welcomes studies that advances peoples knowledge on phenomics the study of phenome that is a set of measurable properties of physical chemical and biological phenotypes of individuals and populations other than the genome The journal is the official publication of International Human Phenome Institutes Shanghai Phenomics provides an international forum for highlighting the cuttingedge scientific advances in the emerging field of phenomics Dedicated and professional editorial team to serve the authors No fee for online subscription publication indexed in PMC
Philosophia;Philosophia Philosophy general Epistemology Ethics Philosophy of Language Philosophy of Mind Philosophy of Science;Philosophia is global in scope submissions and readership We welcome submissions in English from across the world including from perspectives that are underrepresented in the field Submissions should be broadly accessible scholarly contributions on topics of current or emerging philosophical interest and must adhere to high standards of clarity and argumentation Philosophia welcomes contributions in traditional areas of philosophy such as normative ethics metaethics epistemology aesthetics political philosophy general philosophy of science philosophy of language metaphysics and philosophy of mind The journal also encourages contributions to emerging areas such as applied philosophy of language environmental philosophy and philosophy of technology as well as research that advances one or more of Springer Natures Sustainable Development Goals httpswwwspringernaturecomgpresearcherssdgprogramme Contributions to the journal may take the form of special issues or collections topical papers stateofthe art surveys topical symposia short discussion notes and AuthorMeetsCritics symposia
Philosophical Studies;Philosophical Studies Philosophy general Epistemology Philosophy of Mind Ethics Metaphysics Philosophy of Language;Philosophical Studies provides a periodical dedicated to work in analytic philosophy The journal is devoted to the publication of papers in exclusively analytic philosophy and welcomes papers applying formal techniques to philosophical problems The principal aim is to publish articles that are models of clarity and precision in dealing with significant philosophical issues The readers of the journal will be kept abreast of the central issues and problems of contemporary analytic philosophy Philosophical Studies was founded in 1950 by Herbert Feigl and Wilfrid Sellars For inquiries please contact editors Wayne Davis daviswgeorgetownedu or Jennifer Lackey jlackeynorthwesternedu 100 of authors who answered a survey reported that they would definitely publish or probably publish in the journal again
Philosophy Technology;Philosophy Technology Philosophy of Technology;Addresses the expanding scope and unprecedented impact of technologies in order to improve the critical understanding of the conceptual nature and practical consequences and hence provide the conceptual foundations for their fruitful and sustainable developments The journal welcomes highquality submissions regardless of the tradition school of thought or disciplinary background from which they derive Your article in Philosophy Technology Submit your article online via httpwwweditorialmanagercomphte All submissions are subjected to doubleblind peer review the average peer review time is 3 months Authors wishing to submit a reply article or a proposal for a review article a book symposium a special issue or a focused debate are invited to contact the Assistant Editor for further information
Philosophy of Management;Philosophy of Management Philosophy general Business and Management general International Political Economy Quality of Life Research;Philosophy of Management is published four times a year It offers an independent refereed forum for philosophers theorists and management practitioners to apply philosophical scrutiny to management theory and practice It seeks to define and develop the field of philosophy of management and is directed to philosophers working in all traditions Now in its twelfth year Philosophy of Management is the leading forum for philosophicallyinformed thinking about management in theory and practice Through its pages conferences seminars and discussion list it defines and develops the field of philosophy of management Journal readers include thinkers scholars teachers consultants and practitioners in 20 countries The Journal is for philosophers working in all traditions for management thinkers concerned with the philosophical foundations and validity of their subject and practising managers seeking to engage with the philosophical issues raised by what they believe and do Contributors have included leading philosophers management scholars consultants and managers Discusses the philosophy of management in theory and practice Covers business ethics ontology epistemology aesthetics politics and more Four issues per year each focused on a central theme
Philosophy Ethics and Humanities in Medicine;Philosophy Ethics and Humanities in Medicine Philosophy of Medicine Theory of MedicineBioethics;
Photochemical Photobiological Sciences;Photochemical Photobiological Sciences Physical Chemistry Biochemistry general Biomaterials Plant Sciences;Photochemical Photobiological Sciences PPS is a monthly journal for the publication of original research papers Full papers Reviews Perspectives Communications and Technical notes of current interest in the areas of photochemistry and photobiology The journal also contains a Forum section PPS will be published under the Springer imprint as of 2021 and is the official journal of the European Society for Photobiology ESP and the European Photochemistry Association EPA The journal publishes articles on the interaction of light with molecules supramolecular systems or biological matter
PhotoniX;PhotoniX Microwaves RF and Optical Engineering;
Photonic Network Communications;Photonic Network Communications Computer Communication Networks Electrical Engineering Characterization and Evaluation of Materials;This journal publishes papers involving optical communication networks Coverage includes network and system technologies network and system architectures network access and control network design planning and operation interworking and application design for an optical infrastructure This journal publishes highquality peerreviewed papers presenting research results major achievements and trends involving all aspects of optical network communications Among the topics explored are transport access and customer premises networks local regional and global networks transoceanic and undersea networks optical transparent networks WDM HWDM and OTDM networks and more Offers research results major achievements and trends involving alloptical communication networks The first and only journal that focuses primarily on photonic networks Covers network and system technologies and architectures access and control design planning and operation interworking and application design 100 of authors who answered a survey reported that they would definitely publish or probably publish in the journal again
Photonic Sensors;Photonic Sensors Optics Lasers Photonics Optical Devices Measurement Science and Instrumentation Microwaves RF and Optical Engineering;Photonic Sensors is a fully sponsored doubleblind peerreviewed open access journal published under the brand SpringerOpen It presents original peerreviewed articles that report on new developments of interest to members of the photonics and sensor communities in all fields of photonic sensing science and technology The journals coverage includes optical fiber sensors planar waveguide sensors laserbased sensors and biophotonic sensors and more Photonic Sensors focuses on experimental contributions related to novel principles structures or materials for photonic sensors In addition to research articles the journal publishes letters and review articles providing an opportunity to rapidly disseminate research results of timely interest and comprehensive reviews of emerging topics The publication costs are covered by University of Electronic Science and Technology of China so authors do not need to pay an articleprocessing charge The journal operates a doubleblind peerreview system where the reviewers do not know the names or affiliations of the authors and the reviewer reports provided to the authors are anonymous All articles published are made freely and permanently accessible online immediately upon publication without subscription charges or registration barriers Further information about open access can be found at httpswwwspringeropencomaboutopenaccess As authors of articles published in Photonic Sensors you are the copyright holders of your article and have granted to any third party in advance and in perpetuity the right to use reproduce or disseminate your article according to the SpringerOpen copyright and license agreement httpswwwspringeropencomgetpublishedcopyrightcopyrightandlicenseagreement For those of you who are US government employees or are prevented from being copyright holders for similar reasons SpringerOpen can accommodate nonstandard copyright lines Please contact infospringeropencom if further information is needed Reports on new developments in photonic sensing and technology APC fully covered by University of Electronic Science and Technology of China High visibility for your work with open access
Photosynthesis Research;Photosynthesis Research Plant Sciences Plant Physiology Biochemistry general Plant Genetics and Genomics;Photosynthesis Research is an international journal which publishes research in all areas in and related to photosynthesis The journal welcomes basic and applied research at all levels of organization including molecular subcellular cellular whole plants canopy ecosystem and global Research in all photosynthetic systems including natural organisms and semiartificial systems are considered The breadth of research covered by the journal includes and is not limited to the following areas in photosynthesis Light absorption and emission excitation energy transfer charge separation electron and proton transfer catalysis Carbon assimilationmetabolism and photorespiration Structure and function Regulatory phenomena Ecosystems agriculture and the environment Climate change renewable energy and fuels Evolution Research in photosynthesis employing various disciplines are welcome including but not limited to biochemistry biophysics cell and molecular biology genomics theory and modelling Studies taking an interdisciplinary approach with a broad range of experimental and theoretical techniques are encouraged Photosynthesis Research is the official journal of the International Society for Photosynthesis Research ISPR Discusses both basic and applied aspects of photosynthesis Includes research at all levels of plant organization molecular subcellular cellular whole plant canopy ecosystem etc Covers photophosphorylation carbon assimilation regulatory phenomena molecular biology environmental and ecological aspects photorespiration and more
Photosynthetica;Photosynthetica Plant Physiology;
Physical Mesomechanics;Physical Mesomechanics Classical Mechanics Solid State Physics Materials Science general;Physical Mesomechanics deals with the study of the deformation behavior and physicalmechanical properties of materials determined by the relationship between their hierarchical structure and physical mechanisms across multiple scales Physical Mesomechanics is an international peerreviewed journal that publishes theoretical and experimental results in the field of physical mesomechanics and other related areas that effectively utilize physical mesomechanics concepts including the physics of strength and plasticity materials science fracture mechanics geomechanics and geodynamics multiscale approaches to the development of advanced materials nondestructive testing etc The journal accepts fulllength articles and reviews discussing the relationship between the structure physicalmechanical properties deformation and fracture of structural and functional materials including nano and metamaterials composites biomedical and additively manufactured materials and geomaterials The journal welcomes manuscripts from all countries PEER REVIEW Physical Mesomechanics is a peer reviewed journal We use a single blind peer review format The average period from submission to first decision is 15 days The average rejection rate for submitted manuscripts is 44 The final decision on the acceptance of an article for publication is made by the Editorial Board Any invited reviewer who feels unqualified or unable to review the manuscript due to the conflict of interests should promptly notify the editors and decline the invitation Reviewers should formulate their statements clearly in a sound and reasoned way so that authors can use reviewers arguments to improve the manuscript Personal criticism of the authors must be avoided Reviewers should indicate in a review i any relevant published work that has not been cited by the authors ii anything that has been reported in previous publications and not given appropriate reference or citation ii any substantial similarity or overlap with any other manuscript published or unpublished of which they have personal knowledge
Physical Oceanography;Physical Oceanography Oceanography Remote SensingPhotogrammetry Atmospheric Sciences Climate Change Environmental Physics;
Physical and Engineering Sciences in Medicine;Physical and Engineering Sciences in Medicine Biomedicine general Biological and Medical Physics Biophysics Medical and Radiation Physics Biomedical Engineering and Bioengineering;Physical and Engineering Sciences in Medicine is a multidisciplinary forum for information and research on the application of physics and engineering to medicine covering a broad range of topics that include but is not limited to Radiation measurements and nuclear technology in medicine and physiology Medical physics in nuclear medicine radiotherapy and diagnostic radiology Clinical biomedical engineering Signal processing and feature extraction of biomedical signals Medical imaging and image processing contributions to new and improved methods Nanotechnology in medicine Professional issues in medical physics and biomedical engineering Article types include reviews scientific papers notes AI notes book reviews and letters to the editor Physical and Engineering Sciences in Medicine is the journal of the Australasian College of Physical Scientists and Engineers in Medicine and also the official journal of the College of Biomedical Engineers Engineers Australia and the AsiaOceania Federation of Organizations for Medical Physics Details Concerning the Submission and Publication Procedures No Page Charges No Fees for Color Images Online and Print Covers the application of physics and engineering to medicine and biology 100 of authors who answered a survey reported that they would definitely publish or probably publish in the journal again
Physics and Chemistry of Minerals;Physics and Chemistry of Minerals Mineralogy Crystallography and Scattering Methods Geochemistry Mineral Resources;Physics and Chemistry of Minerals is an international journal devoted to publishing articles and short communications of physical or chemical studies on minerals or solids related to minerals Coverage emphasizes applications of modern techniques or new theories and models to interpret atomic structures and physical or chemical properties of minerals The range of topics includes relationships between atomic structure and crystalline state general solid state spectroscopy experimental and theoretical analysis of chemical bonding in minerals physical properties relations between thermal expansion compressibility elastic constants and fundamental properties of atomic structure particularly as applied to geophysical problems electron microscopy in support of physical and chemical studies computational methods in the study of the structure and properties of minerals mineral surfaces and more International coverage of physical and chemical studies on minerals or solids related to minerals Applies modern techniques new theories and models to interpret atomic structure physical and chemical properties Covers chemical bonding compressibility thermal expansion and fundamental properties and more Explores new techniques in electron microscopy computational methods 95 of authors who answered a survey reported that they would definitely publish or probably publish in the journal again
Physics in Perspective;Physics in Perspective Physics general;Physics in Perspective seeks to bridge the gulf between physicists and nonphysicists through historical and philosophical studies that typically display the unpredictable as well as the crossdisciplinary interplay of observation experiment and theory that has occurred over extended periods of time in academic governmental and industrial settings and in allied disciplines such as astrophysics chemical physics and geophysics The journal also publishes firstperson accounts by physicists of significant contributions they have made biographical articles book reviews and guided tours of historical sites in cities throughout the world It strives to make all articles understandable to a broad spectrum of readers scientists teachers students and the public at large Bibliographic Data Phys Perspect 1 volume per year 4 issues per volume approx 500 pages per volume Format 155 x 235cm ISSN 14226944 print ISSN 14226960 electronic
Physics of Atomic Nuclei;Physics of Atomic Nuclei Particle and Nuclear Physics;Physics of Atomic Nuclei is an international peerreviewed journal that covers experimental and theoretical studies of nuclear physics nuclear structure spectra and properties radiation fission and nuclear reactions induced by photons leptons hadrons and nuclei fundamental interactions and symmetries hadrons with light strange charm and bottom quarks particle collisions at high and superhigh energies gauge and unified quantum field theories quark models supersymmetry and supergravity astrophysics and cosmology The journal welcomes manuscripts from all countries PEER REVIEW Physics of Atomic Nuclei is a peer reviewed journal We use a single blind peer review format The average period from submission to first decision is 21 days The average rejection rate for submitted manuscripts is 20 The final decision on the acceptance of an article for publication is made by the Editorial Board Any invited reviewer who feels unqualified or unable to review the manuscript due to the conflict of interests should promptly notify the editors and decline the invitation Reviewers should formulate their statements clearly in a sound and reasoned way so that authors can use reviewers arguments to improve the manuscript Personal criticism of the authors must be avoided Reviewers should indicate in a review i any relevant published work that has not been cited by the authors ii anything that has been reported in previous publications and not given appropriate reference or citation ii any substantial similarity or overlap with any other manuscript published or unpublished of which they have personal knowledge Founded in 1965 the leading Russian journal on elementary particles and nuclei Focuses on experimental and theoretical studies of nuclear physics Coverage includes nuclear structure spectra and properties radiation fission and nuclear reactions induced by photons leptons hadrons and nuclei fundamental interactions and symmetries and more
