Probability Theory and Related Fields;Probability Theory and Related Fields Probability Theory and Stochastic Processes Theoretical Mathematical and Computational Physics Quantitative Finance Mathematical and Computational Biology Statistics for Business Management Economics Finance Insurance Operations ResearchDecision Theory;Please note this journals peer review system has changed it now uses Snapp Springer Natures Article Processing Platform See the journal updates page for more information This journal publishes research papers in modern probability theory its relations to analysis geometry and other areas in mathematics and its various fields of application Besides the main topics of modern probability theory the subjects of interests in Probability Theory and Related Fields include applications of probability theory to mathematical statistical physics ergodic theory mathematical biology mathematical statistics and theoretical computer science Publishes research papers in modern probability theory its relations to analysis geometry and other areas in mathematics and its various fields of application Contains survey papers on emerging areas of importance
Probability Uncertainty and Quantitative Risk;Probability Uncertainty and Quantitative Risk Probability Theory and Stochastic Processes;
Probiotics and Antimicrobial Proteins;Probiotics and Antimicrobial Proteins Microbiology Applied Microbiology ChemistryFood Science general Protein Science Nutrition;Probiotics and Antimicrobial Proteins publishes reviews original articles letters and short notes and technicalmethodological communications aimed at advancing fundamental knowledge and exploration of the applications of probiotics natural antimicrobial proteins and their derivatives in biomedical agricultural veterinary food and cosmetic products The Journal welcomes fundamental research articles and reports on applications of these microorganisms and substances and encourages structural studies and studies that correlate the structure and functional properties of antimicrobial proteins Advances understanding of the applications of probiotics natural antimicrobial proteins and derivatives Explores their use in biomedicine agriculture food cosmetics and other industries Includes both fundamental and applied research
Problems of Information Transmission;Problems of Information Transmission Communications Engineering Networks Electrical Engineering Information Storage and Retrieval Systems Theory Control;Problems of Information Transmission is an international peerreviewed journal devoted to the studies and development of communication systems This quarterly journal features coverage of statistical information theory coding theory and techniques noisy channels error detection and correction signal detection extraction and analysis analysis of communication networks optimal processing and routing the theory of random processes and bionics The journal welcomes manuscripts from all countries PEER REVIEW Problems of Information Transmission is a peer reviewed journal We use a single blind peer review format The average rejection rate for submitted manuscripts is 52 The final decision on the acceptance of an article for publication is made by the Editorial Board Any invited reviewer who feels unqualified or unable to review the manuscript due to the conflict of interests should promptly notify the editors and decline the invitation Reviewers should formulate their statements clearly in a sound and reasoned way so that authors can use reviewers arguments to improve the manuscript Personal criticism of the authors must be avoided Reviewers should indicate in a review i any relevant published work that has not been cited by the authors ii anything that has been reported in previous publications and not given appropriate reference or citation ii any substantial similarity or overlap with any other manuscript published or unpublished of which they have personal knowledge Official Journal of the Russian Academy of Sciences Investigates all aspects of communication systems research and development Covers statistical information theory coding theory and techniques noisy channels error detection and correction signal detection extraction and analysis etc English translation of Problemy Peredachi Informatsii
Proceedings Mathematical Sciences;Proceedings Mathematical Sciences Mathematics general;This journal publishes refereed papers covering current research in mathematics The papers present results of original work critical reviews of important fields and applied areas The journal also features special issues devoted to advances in specific areas of mathematics and proceedings of selected high quality conferences Published by the Indian Academy of Sciences Publishes refereed papers covering current research in mathematics Includes papers that present results of original work critical reviews of important fields and applied areas Features special issues devoted to advances in specific areas of mathematics and proceedings of selected high quality conferences
Proceedings Indian Academy of Sciences;Proceedings Plant Sciences Life Sciences general;
Proceedings of the Indian National Science Academy;Proceedings of the Indian National Science Academy Materials Science general;The Proceedings is a broad scope peer reviewed journal publishing original research articles reviews commentariesopinion meeting reports book reviews and Academy news The scope of journal encompasses physics chemical sciences earth planetary sciences engineering technology material sciences engineering plant sciences animal sciences microbiology immunology cell biomolecular sciences and health sciences and agricultural sciences Original research papers in the areas of pure and applied mathematics are not considered However articles in areas of pure and applied mathematics which are of interest to a broad readership and those based on Indian National Science Academy INSA award lectures and reviewssurveys contributed by newly elected INSA fellows and YS awardees can be considered for publication in the journal All articles including those invited are peerreviewed In addition to the regular issues Special Issues or Sections on thematic topics are also published periodically The journal has an illustrious historyit started when the then National Institute of Sciences of India now the Indian National Science Academy was inaugurated on 7 January 1935 at Calcutta and commissioned this journal Proceedings of the National Institute of Sciences of India in the same year for publishing articles from all the branches of science As the number of accepted papers increased the journal was bifurcated in 1955 into two parts Part A Physical Sciences and Part B Biological Sciences When the National Institute of Sciences of India was renamed as the Indian National Science Academy in 1970 the journal became Proceedings of the Indian National Science Academy It continued to be published in two parts with six issues each in a calendar year In 1997 the Academy decided to publish only review articles of contemporary scientific interest evaluating advances and newer approaches in the given field The emphasis thus shifted from being a vehicle of original research reports into one of reviews and comprehensive summary reports on chosen topics Thus from the beginning of January 1998 the Proceedings brought out thematic issues containing invited reviews on current scientific topics Beginning from the year 2006 the Academy merged the Parts A and B so that each issue of the Proceedings is interdisciplinary and covers areas under Physical Biological and Applied Sciences including Engineering and today the journal publishes original articles along with reviews
Proceedings of the National Academy of Sciences India Section A Physical Sciences;Proceedings of the National Academy of Sciences India Section A Physical Sciences Physics general Applied and Technical Physics Atomic Molecular Optical and Plasma Physics Quantum Physics;The Proceedings of the National Academy of Sciences India Section A Physical Sciences is one of the oldest journals of India launched in the year 1930 by the National Academy of Sciences India the Oldest Science Academy of India The researchreview papers of different fields of science eg Chemical Sciences Analytical Inorganic Organic Physical Theoretical Chemistry Applied Chemistry Earth Sciences Atmospheric Sciences GeoSciences Oceanography GeographyScientific aspects Engineering Sciences including Engineering Technology Engineering and Engineering Science Chemical and Material Technology Electronics Telecommunication Information Technology Instrumentation Mathematical Sciences Pure Mathematics Applied Mathematics Statistics ComputerInformation Science and Physical Sciences including Astronomy Astrophysics Experimental and Theoretical Physics Applied Physics are published in this journal for dissemination of the scientific knowledge and research The papers published are indexedabstracted by the leading abstracting agencies of the world The papers are published after critical review and editing by the eminent experts of the concerned subject area therefore the quality publication is assured once the paper is accepted by the learned referees i The research review articles are contributed by the scientists of world repute ii The articles are indexedabstracted by the world class abstractingindexing agencies iii The articles are published only after getting it reviewed by the eminent experts
Proceedings of the National Academy of Sciences India Section B Biological Sciences;Proceedings of the National Academy of Sciences India Section B Biological Sciences Life Sciences general Behavioral Sciences Plant Biochemistry Nucleic Acid Chemistry;The Proceedings of the National Academy of Sciences India Section B Biological Sciences is one of the oldest journals of India launched in the year 1930 by the National Academy of Sciences India the Oldest Science Academy of India The researchreview papers of different fields of science eg Agriculture Sciences Agriculture Animal Husbandry Fisheries Forestry Agric Toxicology Soil Science Plant Protection Post Harvest Technology and Agricultural Engineering Animal Sciences Structural Developmental Functional Genetical Ecological Behavioural Taxonomical and Evolutionary Aspects Biochemistry Biophysics Biotechnology including Molecular and Cell Biology Structural and Functional Studies Microbiology and Immunology Medical Forensic Sciences Basic and Clinical Medical Sciences Pharmacology Anthropology Psychology and Forensic Sciences Human genetics Reproduction Biology Neurosciences and Molecular Medicine and Plant Sciences Structural Developmental Functional Genetical Ecological Taxonomical and Evolutionary Aspects are published in this journal for dissemination of the scientific knowledge and research The papers published are indexedabstracted by the leading abstracting agencies of the world The papers are published after critical review and editing by the eminent experts of the concerned subject area therefore the quality publication is assured once the paper is accepted by the learned referees i The research review articles are contributed by the scientists of world repute ii The articles are indexedabstracted by the world class abstractingindexing agencies iii The articles are published only after getting it reviewed by the eminent experts
Proceedings of the Steklov Institute of Mathematics;Proceedings of the Steklov Institute of Mathematics Mathematics general;Proceedings of the Steklov Institute of Mathematics is an international peerreviewed quarterly journal Each issue contains a collection of articles pertaining to one or several related topics Along with the editorial board each issue has its own guest editors The journal welcomes manuscripts from all countries PEER REVIEW Proceedings of the Steklov Institute of Mathematics is a peer reviewed journal We use a single blind peer review format The average period from submission to first decision is 37 days The average rejection rate for submitted manuscripts is 31 The final decision on the acceptance of an article for publication is made by the Editorial Board Any invited reviewer who feels unqualified or unable to review the manuscript due to the conflict of interests should promptly notify the editors and decline the invitation Reviewers should formulate their statements clearly in a sound and reasoned way so that authors can use reviewers arguments to improve the manuscript Personal criticism of the authors must be avoided Reviewers should indicate in a review i any relevant published work that has not been cited by the authors ii anything that has been reported in previous publications and not given appropriate reference or citation ii any substantial similarity or overlap with any other manuscript published or unpublished of which they have personal knowledge
Proceedings of the Zoological Society;Proceedings of the Zoological Society Life Sciences general Zoology Animal Anatomy Morphology Histology Animal Genetics and Genomics Biodiversity Conservation BiologyEcology;The Society is publishing Proceedings of the Zoological Society since 1948 which is now recognized as an internationally reputed Journal and is widely circulated all over India and abroad With sincere efforts of the entire editorial board the Journal has been updated and quality of printing has been improved to a great extent The Journal mainly accepts original research papers containing new facts on any discipline of zoology Animal physiology Comparative Endocrinology Behavioural Biology Cell biology and genetics Ecology Entomology Evolutionary biology Fisheries and Aquaculture Immunology Plant animal Interaction Stem Cell Biology Toxicology Checklist of taxonomy and description will not be accepted Articles with new interpretations of the existing knowledge is strongly encouraged for submission This Journal follows Double Blind peer review process aofficial publication of the prestigious Zoological Society Kolkata India b premier Indian journal in the field of Animal Sciences
Proceedings Animal Sciences;Proceedings Animal Sciences Life Sciences general;
Process Integration and Optimization for Sustainability;Process Integration and Optimization for Sustainability Industrial and Production Engineering Sustainable Development Industrial ChemistryChemical Engineering Energy Policy Economics and Management Waste ManagementWaste Technology;Congratulations to the EditorinChiefs board and reviewers of Process Integration and Optimization for Sustainability PIOS is a top rated Springer Nature journal Read more under journal updates Process Integration and Optimization for Sustainability is now indexed in Scopus Emerging Sources Citation Index ESCI EI Compendex Visit the Journal Updates section for more information on Special Issue Call for Papers Free access to Editors Highlights available from now till 25 Apr 2022 This journal is an interdisciplinary platform for information on innovation research development and demonstration in the areas of resource conservation optimal use of various resources analysis and optimization of various systems and processes reduction and mitigation of environmental pollutions and overall sustainable developments It provides an international forum to researchers policy makers decision makers managers consultants and planners to publish learn and discuss about various aspects related to Process Integration and Optimization The breadth of coverage ranges from various optimization and system analysis methods such as mathematical programming pinch analysis Pgraphs heuristics based approaches decision analysis fuzzy optimization etc to applications innovations and methodological developments for resource conservation This journal publishes the following types of contributions Original research papers that propose novel methodology Review articles providing surveys and critical appraisal of developments in a specific topic of interest Short communications describing initial research findings of potential significance or substantive comments on previously published papers Short technical notes that focus on the implementation of established methodology eg industrial case studiessuccess stories software tools Offers a medium for Process Integration researchers to share and exchange ideas both from academia and industry Stimulates resource conservation and optimization pollution reduction and mitigation and overall sustainable development Enables industries to contribute in publishing as well as to adopt the described concepts in their practices
Production Engineering;Production Engineering Industrial and Production Engineering Production;Production Engineering Research and Development reports peer reviewed results of latest research in industrial engineering production engineering and industrial organization The high level and focus on both the scientific as well as the practical impact of the selected papers will bridge the gap between research and successful industrial application Researchers in production engineering as well as in operation management and supply chain organization will find recent valuable developments The main topics span from novel production processes via computer aided engineering to process chain and factory management Frequently published key note papers provide succinct reviews on the recent progress in particular research areas Reports peer reviewed results of latest research in industrial engineering production engineering and industrial organization Bridges the gap between research and successful industrial applications Topics span from novel production processes via computer aided engineering to process chain and factory management
Programming and Computer Software;Programming and Computer Software Computer Science general Software EngineeringProgramming and Operating Systems Operating Systems Software Engineering Artificial Intelligence;Programming and Computer Software is an international peerreviewed journal devoted to problems in all areas of computer science operating systems compiler technology software engineering artificial intelligence etc The journal welcomes manuscripts from all countries PEER REVIEW Programming and Computer Software is a peer reviewed journal We use a double blind peer review format The average period from submission to first decision is 53 days The average rejection rate for submitted manuscripts is 91 The final decision on the acceptance of an article for publication is made by the Editorial Board Any invited reviewer who feels unqualified or unable to review the manuscript due to the conflict of interests should promptly notify the editors and decline the invitation Reviewers should formulate their statements clearly in a sound and reasoned way so that authors can use reviewers arguments to improve the manuscript Personal criticism of the authors must be avoided Reviewers should indicate in a review i any relevant published work that has not been cited by the authors ii anything that has been reported in previous publications and not given appropriate reference or citation ii any substantial similarity or overlap with any other manuscript published or unpublished of which they have personal knowledge
Progress in Additive Manufacturing;Progress in Additive Manufacturing Manufacturing Machines Tools Processes Materials Science general Optics Lasers Photonics Optical Devices;Progress in Additive Manufacturing PIAM publishes scientific papers that report original and significant research related to established and emerging Additive Manufacturing AM processes and technologies It provides technically and industrially relevant results and data and serves as a platform for academia and industry PIAM specifically welcomes original contributions that present and discuss novelties covering the value chain of AM In this context added value is specifically seen in the use of simulation methods in all processing steps and the use of artificial intelligence and data analytics to extend prediction and control capabilities Manuscripts are also encouraged to consider and discuss the results in the context of their contribution to the circular economy resource efficiency and environmental aspects The journal welcomes full papers review articles and short communications in the following AM topics Design for AM Design optimization principles and lattice structures as well as incorporating reverse engineering Material simulation considering the specific AM process conditions and requirements including use of modelling and digital twins AM material characterization such as microstructures and phases and related physical properties AM process and material development and optimization including hybrid process strategies postprocessing and other multimaterial and composite processing approaches Metrology for AM including Non Destructive Testing process monitoring and qualification and the use of artificial intelligence methods and advanced data analytics to extend prediction and control capabilities Innovative approaches for AM data handling including but not limited to 2D or 3Dmodelmachine data representation and data chains including quality assurance Innovative and new applications of AM parts including but not limited to functional integration and high temperature or high performance applications medical and their characterization and testing Sustainability aspects in AM including but not limited to process evaluation and component lifecycle assessment Reduced peerreview time for short communications Doubleblinded peerreview system for all submitted papers Interdisciplinary topics ranging from data processing to simulation new and hybrid process to materials and microstructural analysis
Progress in Artificial Intelligence;Progress in Artificial Intelligence Data Mining and Knowledge Discovery Artificial Intelligence Computer Imaging Vision Pattern Recognition and Graphics Natural Language Processing NLP Computational Intelligence Control Robotics Mechatronics;This journal publishes toplevel research results in all aspects of artificial intelligence with a particular emphasis on the following topics data mining soft computing and computational intelligence knowledge complexity logic planning reasoning and search agents and multiagent systems artificial vision and robotics and natural language and Web intelligence The journal is published in cooperation with the Spanish association of artificial intelligence AEPIA and the Editorial Board includes leading international figures in all related research topics
Progress in Biomaterials;Progress in Biomaterials Biomaterials;Progress in Biomaterials is a peerreviewed hybrid journal It is a multidisciplinary Englishlanguage publication of original contributions and reviews concerning studies of the preparation performance and evaluation of biomaterials the chemical physical biological and mechanical behavior of materials both in vitro and in vivo in areas such as tissue engineering and regenerative medicine drug delivery and implants where biomaterials play a significant role Approved by Ministry of Science Research and Technology
Progress in Earth and Planetary Science;Progress in Earth and Planetary Science Earth Sciences general GeophysicsGeodesy Planetology Biogeosciences Hydrogeology Atmospheric Sciences;
Progress in Orthodontics;Progress in Orthodontics Dentistry;
Progress in STEM CELL;Progress in STEM CELL MedicinePublic Health general;
Protection and Control of Modern Power Systems;Protection and Control of Modern Power Systems Energy Systems Renewable and Green Energy Power Electronics Electrical Machines and Networks;
