Plant Physiology Reports;Plant Physiology Reports Plant Sciences Plant Physiology Plant Ecology Plant Biochemistry Cell Biology Plant Genetics and Genomics;Plant Physiology Reports is the official publication of the Indian Society for Plant Physiology and is published quarterly ie March June September and December every year The journal publishes review articles original full research papers and short communications in the field of plant physiology biochemistry molecular biology horticulture genetics agronomy and other cognate sciences which are of primary interest to plant physiologists The contribution of manuscripts to the journal is open to all researchers irrespective of their membership to Indian Society for Plant Physiology This Journal follows single blind peer review process 1 Indian Society of Plant Physiology was created in 1958 making it one of the oldest and established societies and in the same year the Indian Journal of Plant Physiology was launched which is now known as Plant Physiology Reports 2 The Society is based in Indian Agricultural Research Institute IARI the premier institute in the field of agriculture 3 The journal is an official publication of a strong society that has about 870 life members and 35 annual members 4 The subscription base of the journal is about 220 mostly institutional 5 The editorial board has a good balance of national and international editors with a ratio of 13
Plant Reproduction;Plant Reproduction Cell Biology Plant Sciences Agriculture;Plant Reproduction formerly known as Sexual Plant Reproduction is a journal devoted to publishing highquality research in the field of reproductive processes in plants Article formats include original articles short communications reviews perspectives method papers and opinion papers Articles are selected based on significance for the field of plant reproduction spanning from the induction of flowering to fruit development Topics include but are not limited to Floral induction flower organ development Meiosis Male female gametogenesis Pollen tube growth and guidance Selfincompatibility Fertilization mechanisms Apomixis Embryogenesis Seed biology Fruit development Epigenetics imprinting Quantitative analysis of reproduction Modelling of reproductive mechanisms Evolution of reproductive systems speciation Biotechnological applications in reproduction Studies in model organisms where mechanisms of reproduction can be supported by genetic or biochemical evidence are strongly encouraged The journal provides new insights on reproductive processes in plants Welcomes original research short communication review method perspective and opinion articles The official journal of the International Association of Sexual Plant Reproduction Research IASPRR
Plant Systematics and Evolution;Plant Systematics and Evolution Plant Sciences Plant Ecology Plant AnatomyDevelopment Plant SystematicsTaxonomyBiogeography;Plant Systematics and Evolution aims to bridge the specific subject areas in plant systematics and evolution encompassing evolutionary phylogenetic genomic and biogeographical studies at the population and higher taxonomic levels Taxonomic emphasis is on all land plant groups in a wide sense including fungi and lichens Why Publish With Us Author satisfaction 45 out of 5 on peer review and editorial advice Speed Full and final citation information available as soon as articles appear online Reach over 1K readers on any given article The journal bridges the specific subject areas in plant systematics and evolution encompassing evolutionary phylogenetic genomic and biogeographical studies Coverage includes plant systematics and taxonomy plant genome evolution and biodiversity ecology bioinformatics genomics population genetics and more
Plant and Soil;Plant and Soil Plant Sciences Soil Science Conservation Plant Physiology Ecology Agriculture;Plant and Soil publishes original papers and review articles exploring the interface of plant biology and soil sciences and that enhance our mechanistic understanding of plantsoil interactions This includes both fundamental and applied aspects of mineral nutrition plantwater relations symbiotic and pathogenic plantmicrobe interactions root anatomy and morphology soil biology ecology agrochemistry and agrophysics Articles discussing a major molecular or mathematical component also fall within the scope of the journal All contributions appear in the English language The EditorinChief is Hans Lambers University of Western Australia Crawley Australia Why publish with us We explore the interface of plant biology and soil sciences We provide high levels of author satisfaction with 96 of our published authors reporting that they would definitely or probably publish with us again Through Springer Compact agreements authors from participating institutions can publish Open Choice at no cost to the authors
Planta;Planta Plant Sciences Agriculture Ecology Forestry;Planta publishes timely sound and complete articles on all aspects of plant biology Works submitted for publication should contribute with new knowledge and further advance the state of the art Current Call for Papers We invite you to submit to our open topical collections Planta welcomes original research on any plant species Areas of interest include biochemistry bioenergy biotechnology cell biology development ecological and environmental physiology growth metabolism morphogenesis molecular biology new methods physiology plantmicrobe interactions structural biology and systems biology Review articles summarize recent advances in topical areas of plant biology The EditorsinChief of Planta are Dorothea Bartels Institut fr Molekulare Physiologie und Biotechnologie der Pflanzen IMBIO Universitt Bonn Germany and Anastasios Melis University of California Berkeley CA USA Planta s cited halflife the median age of articles that were cited in a given Journal Citation Report year is 10 years Why publish with us First published in 1925 our journal has been ranked in the top quartile of plant sciences journals for many years We welcome research in all areas of plant biology including work on nonmodel species With our swift and rigorous editorial process we publish articles in their final form as soon as they are ready We deliver high levels of author satisfaction with 94 of our published authors reporting that they would definitely or probably publish with us again
Plasma Chemistry and Plasma Processing;Plasma Chemistry and Plasma Processing Inorganic Chemistry Classical Mechanics Characterization and Evaluation of Materials Mechanical Engineering;Plasma Chemistry and Plasma Processing is an international journal that provides a forum for the publication of original papers on fundamental research and new developments in plasma chemistry and plasma processing The journal encompasses all types of industrial processing plasmas ranging from nonthermal plasmas to thermal plasmas and publishes fundamental plasma studies as well as studies of specific plasma applications Application contexts of interest include plasma etching in microelectronics and other fields deposition of thin films and coatings powder synthesis environmental processing lighting surface modification and others Includes studies of chemical kinetics in plasmas and the interactions of plasmas with surfaces Please note we are working with a new submission system In case you have questions regarding a submission made before February 2023 please access the system via the link provided to you in the submission confirmation email We are currently preparing a special issue on DielectricBarrier Discharges and their Applications in commemoration of the 20th anniversary of Kogelschatzs work Found out more here An international forum for fundamental research and new developments in plasma chemistry and plasma processing Offers fundamental plasma studies and studies of specific applications Covers plasma etching in microelectronics deposition of thin films and coatings powder synthesis environmental processing lighting surface modification and more 96 of authors who answered a survey reported that they would definitely publish or probably publish in the journal again
Plasma Physics Reports;Plasma Physics Reports Atomic Molecular Optical and Plasma Physics;Plasma Physics Reports is an international peerreviewed journal devoted to plasma physics The journal covers the following topics hightemperature plasma physics related to the problem of controlled nuclear fusion based on magnetic and inertial confinement physics of cosmic plasma including magnetosphere plasma sun and stellar plasma etc gas discharge plasma and plasma generated by laser and particle beams The journal also publishes papers on such related topics as plasma electronics generation of radiation in plasma and plasma diagnostics As well as other original communications the journal publishes topical reviews and conference proceedings The journal welcomes manuscripts from all countries PEER REVIEW Plasma Physics Reports is a peer reviewed journal We use a double blind peer review format The average period from submission to first decision is 40 days The average rejection rate for submitted manuscripts is 40 The final decision on the acceptance of an article for publication is made by the Editorial Board Any invited reviewer who feels unqualified or unable to review the manuscript due to the conflict of interests should promptly notify the editors and decline the invitation Reviewers should formulate their statements clearly in a sound and reasoned way so that authors can use reviewers arguments to improve the manuscript Personal criticism of the authors must be avoided Reviewers should indicate in a review i any relevant published work that has not been cited by the authors ii anything that has been reported in previous publications and not given appropriate reference or citation ii any substantial similarity or overlap with any other manuscript published or unpublished of which they have personal knowledge Published since the infancy of plasma physics founded 1975 Covers hightemperature plasma physics connected with the problem of controlled nuclear fusion based on magnetic and inertial confinement physics of cosmic plasma gas discharge plasma and more Along with other original communications the journal offers topical reviews and conference proceedings
Plasmas and Polymers;Plasmas and Polymers Classical Mechanics Characterization and Evaluation of Materials Mechanical Engineering Inorganic Chemistry Nuclear Physics Heavy Ions Hadrons;
Plasmonics;Plasmonics Biotechnology Nanotechnology Biological and Medical Physics Biophysics Biochemistry general;Plasmonics publishes peerreviewed articles that both advance and report on the knowledge and practice of the interactions of freemetal electrons Plasmons Coverage includes theory physics and applications of surface plasmons in metals and rapidly emerging areas of nanotechnology biophotonics sensing biochemistry and medicine The journal covers the theory synthesis and optical properties of noble metal nanostructures patterned surfaces continuous or grated surfaces and devices Applications include surfaceenhanced spectroscopic properties such as Raman scattering or fluorescence as well developments in techniques such as surface plasmon resonance and nearfield scanning optical microscopy Papers describe new plasmonic based devices new synthetic procedures for the preparation of nanostructures and their optical properties as well their applications in analytical sensing The journal presents reviews rapid communications letters to the editors and technical and design notes Plasmonics is edited by Professor Chris D Geddes Director of the Institute of Fluorescence at the University of Maryland Baltimore County Maryland USA httptheinstituteoffluorescencecomindexhtml Publishes peerreviewed articles that advance and report on interactions of freemetal electrons Plasmons Describes new plasmonic based devices new synthetic procedures for the preparation of nanostructures and their optical properties and their applications in analytical sensing Presents reviews rapid communications letters to the editors and technical and design notes
Pneumo News;Pneumo News PneumologyRespiratory System;Pneumo News bietet praxisnahe Fortbildung zu allen Fachgebieten der Lungenheilkunde Kernstck sind von Experten verfasste und kommentierte Referate der aktuellen internationalen Fachliteratur Auerdem werden Fallberichte bersichtsarbeiten und in jeder Ausgabe ein praxisrelevantes CMEModul angeboten Die Highlights von nationalen und internationalen Pneumologiekongressen werden in Berichten und Interviews vorgestellt
Pneumonia;Pneumonia PneumologyRespiratory System Infectious Diseases;
PodoPost;PodoPost Internal Medicine;Podopost is het grootste vakblad voor de voetverzorger en pedicure In Podopost vindt u onder andere interessante vakgerichte artikelen geschreven door ervaren vakgenoten en praktijkverhalen Daarnaast vindt u artikelen over cosmetische voetverzorging interviews met uw collegas productinformatie en natuurlijk het laatste nieuws
Podosophia;Podosophia Internal Medicine;Podosophia richt zich in het bijzonder op podotherapeuten De redactie publiceert onder andere artikelen van deskundige podotherapeuten sportartsen bewegingswetenschappers praktijkadviseurs docenten en revalidatieartsen Podosophia stelt zich ten doel de beroepsgroep van podotherapeuten te voorzien van informatie die nodig is voor het inhoudelijk uitoefenen van het vak en het voeren van de praktijk Daarbij is ook ruim aandacht voor de specialisaties sportpodotherapie en diabetespodotherapie
Poiesis Praxis;Poiesis Praxis Ethics;
Polar Biology;Polar Biology Ecology Oceanography Microbiology Plant Sciences Zoology;Call for Papers Special Issue on Bioticallymediated nutrient transfer see Journal Updates page for submission information Polar Biology is a focal point for biologists working in polar regions It is also of interest to scientists working in biology ecology and physiology in general as well as in oceanography and climatology related to polar life Polar Biology publishes Research papers Reviews Brief Reports Correspondence and Comments that present results of studies on plants animals and microorganisms of ocean land and freshwater habitats in polar and subpolar regions of both hemispheres from a wide range of topics Taxonomy Biogeography Life History Spatiotemporal Patterns in Abundance and Diversity Ecological Interactions Trophic Ecology Ecophysiology Biochemistry of Adaptation Biogeochemical Pathways and Cycles Ecological Models Human Impact Climate Change Conservation Why publish in Polar Biology The journals diverse and international editorial board includes representation across many subspecialties of research The journal welcomes authors to collaborate and contribute to special topical collections and supplements for consideration POBI welcomes diverse contributions that focus on original research within the Arctic and Antarctic regions The journal is pleased to announce that its 2021 Impact Factor is 2198 and it is ranked in two Clarivate categories Ecology and Biodiversity Conservation
Policy Sciences;Policy Sciences Political Science Economic Policy Public Administration;With an interdisciplinary and international focus Policy Sciences encourages a diversity of perspectives The editors especially welcome conceptual and empirical innovation together with the potential richness and insight of comparative orientation The journal offers articles that examine the normative aspects of policy sciences conceptual articles addressing concrete policy issues articles on particularly controversial pieces of analysis opposing perspectives including critiques and rejoinders on articles already published which open the journal to an exchange of views rather than restricting it to pure presentation and special issues that analyze specific topics in depth Policy Sciences favors but does not publish exclusively works that either explicitly or implicitly utilize the policy sciences framework The policy sciences are a distinctive subset within the policy movement in that they embrace the traditions of innovated and elaborated by Harold D Lasswell and Myers S McDougal The policy sciences can be applied to articles with greater or lesser intensity to accommodate the focus of an authors work At the minimum this means taking a problem oriented multimethod or contextual approach For additional direction authors may consult our Aims and Scope section httpwwwspringercomsocialsciencespoliticalsciencejournal11077 Officially cited as Policy Sci Brings an interdisciplinary and international focus to the study of policy Welcomes conceptual and empirical innovation Addresses the normative aspects of policy sciences and concrete policy issues along with analysis critiques and discussion Publishes special issues probing specific topics in depth
Political Behavior;Political Behavior Political Science Sociology general;Political Behavior publishes original research in the general fields of political behavior institutions processes and policies Coverage focuses on conventional and unconventional political behavior of individuals or small groups and of large organizations that participate in the political process such as parties interest groups political action committees governmental agencies and mass media As an interdisciplinary journal Political Behavior integrates a variety of analytical approaches across different levels of theoretical abstraction and empirical domain The exploration includes economic perspectives in preference structuring and bargaining psychological aspects of attitude motivations and perceptions sociological orientation of roles group or class or political stance in decision making coalitions and influence Please keep submissions to 7500 words or fewer Officially cited as Polit Behav Published in association with the Elections Public Opinion and Voting Behavior section of the American Political Science Association Follow Political Behavior online facebookcompoliticalbehavior Twitter PolBehavior WordPress politicalbehaviorwordpresscom httpwwwapsanetorgsection32 Publishes original research on political behavior institutions processes and policies Focuses on behavior of individuals small groups and large organizations Integrates a variety of analytical approaches
Politische Vierteljahresschrift;Politische Vierteljahresschrift Political Science and International Relations general Political Science German Politics Political Theory;Die Politische Vierteljahresschrift PVS German Political Science Quarterly bietet Raum fr neueste Forschungsergebnisse aus allen Teildisziplinen der Politikwissenschaft Sie beinhaltet doppelblind begutachtete Beitrge aus der Politischen Theorie und Ideengeschichte aus dem Bereich Analyse und Vergleich politischer Systeme aus der PolicyAnalyse aus dem Bereich der Internationalen Beziehungen und der Auenpolitik aus der empirischen Sozialforschung und Methodenlehre der Politischen Soziologie sowie der Didaktik der Politikwissenschaft Die in der PVS verffentlichten Beitrge stammen von deutschen bzw deutschsprachigen Politikwissenschaftlerinnen sowie von internationalen Politikwissenschaftlerinnen die sich mit der deutschen bzw deutschsprachigen Politikwissenschaft auseinandersetzen Die PVS wird im Social Sciences Citation Index SSCI erfasst Politische Vierteljahresschrift PVS German Political Science Quarterly GPSQ publishes the latest doubleblind peerreviewed research results from all subdisciplines of political science It thus includes original contributions from political theory and the history of ideas from the analysis and comparison of political systems from policy analysis from the field of international relations and foreign policy from empirical social research and methodology from political sociology as well as political science pedagogy The contributions published in PVS come from German or Germanspeaking political scientists as well as from international political scientists who refer to the German or Germanspeaking political sciences PVS is listed in the Social Sciences Citation Index SSCI
Polity;Polity Political Science and International Relations general Political Science International Relations US Politics Political Theory;
Polymer Bulletin;Polymer Bulletin Polymer Sciences Soft and Granular Matter Complex Fluids and Microfluidics Characterization and Evaluation of Materials Physical Chemistry Organic Chemistry;Polymer Bulletin publishes significant advances in polymer science including chemistry physical chemistry physics and material science It aims to provide a meeting ground for researchers who daily encounter problems related to polymers and who welcome opportunities to share their discoveries in a most expeditious manner Publishes research papers reviews and featured articles Cuttingedge developments in Polymer Science
Polymer Science Series A;Polymer Science Series A Polymer Sciences;Polymer Science Series A is an international peerreviewed journal that publishes experimental and theoretical papers and reviews devoted to physicochemical studies of the structure and properties of polymers six issues a year The journal presents original papers and reviews covering all fundamental aspects of macromolecular science Contributions should be of marked novelty and interest for a broad readership Online submission via Internet is available at httppolymsciru The journal welcomes manuscripts from all countries PEER REVIEW Polymer Science Series A is a peer reviewed journal We use a single blind peer review format The average period from submission to first decision is 40 days The average rejection rate for submitted manuscripts is 51 The final decision on the acceptance of an article for publication is made by the Associate Editor Any invited reviewer who feels unqualified or unable to review the manuscript due to the conflict of interests should promptly notify the editors and decline the invitation Reviewers should formulate their statements clearly in a sound and reasoned way so that authors can use reviewers arguments to improve the manuscript Personal criticism of the authors must be avoided Reviewers should indicate in a review i any relevant published work that has not been cited by the authors ii anything that has been reported in previous publications and not given appropriate reference or citation ii any substantial similarity or overlap with any other manuscript published or unpublished of which they have personal knowledge
Polymer Science Series B;Polymer Science Series B Polymer Sciences;Polymer Science Series B is an international peerreviewed journal that publishes experimental and theoretical papers and reviews dealing with the synthesis kinetics catalysis and chemical transformations of macromolecules supramolecular structures and polymer matrixbased composites six issues a year The journal presents original papers and reviews covering all fundamental aspects of macromolecular science Contributions should be of marked novelty and interest for a broad readership Online submission via Internet is available at httppolymsciru The journal welcomes manuscripts from all countries PEER REVIEW Polymer Science Series B is a peer reviewed journal We use a single blind peer review format The average period from submission to first decision is 40 days The average rejection rate for submitted manuscripts is 51 The final decision on the acceptance of an article for publication is made by the Associate Editor Any invited reviewer who feels unqualified or unable to review the manuscript due to the conflict of interests should promptly notify the editors and decline the invitation Reviewers should formulate their statements clearly in a sound and reasoned way so that authors can use reviewers arguments to improve the manuscript Personal criticism of the authors must be avoided Reviewers should indicate in a review i any relevant published work that has not been cited by the authors ii anything that has been reported in previous publications and not given appropriate reference or citation ii any substantial similarity or overlap with any other manuscript published or unpublished of which they have personal knowledge
Polymer Science Series C;Polymer Science Series C Polymer Sciences;Polymer Science Series C Selected Topics is an international peerreviewed journal that publishes experimental and theoretical papers and reviews on the trending topics of macromolecular science chosen by the editorial board two issues a year Only solicited publication in the journal is possible Contributions should be of marked novelty and interest for a broad readership Online submission via Internet is available at httppolymsciru PEER REVIEW Polymer Science Series C is a peer reviewed journal We use a single blind peer review format The average period from submission to first decision is 40 days The average rejection rate for submitted manuscripts is 51 The final decision on the acceptance of an article for publication is made by the Associate Editor Any invited reviewer who feels unqualified or unable to review the manuscript due to the conflict of interests should promptly notify the editors and decline the invitation Reviewers should formulate their statements clearly in a sound and reasoned way so that authors can use reviewers arguments to improve the manuscript Personal criticism of the authors must be avoided Reviewers should indicate in a review i any relevant published work that has not been cited by the authors ii anything that has been reported in previous publications and not given appropriate reference or citation ii any substantial similarity or overlap with any other manuscript published or unpublished of which they have personal knowledge
