PARSMitteilungen;PARSMitteilungen Computer Science general;
PFG Journal of Photogrammetry Remote Sensing and Geoinformation Science;PFG Journal of Photogrammetry Remote Sensing and Geoinformation Science Remote SensingPhotogrammetry Geographical Information SystemsCartography Signal Image and Speech Processing Computer Imaging Vision Pattern Recognition and Graphics Astronomy Observations and Techniques Aerospace Technology and Astronautics;PFG is an international scholarly journal covering the progress and application of photogrammetric methods remote sensing technology and the interconnected field of geoinformation science It places special editorial emphasis on the communication of new methodologies in data acquisition and new approaches to optimized processing and interpretation of all types of data which were acquired by photogrammetric methods remote sensing image processing and the computeraided interpretation of such data in general The journal hence addresses both researchers and students of these disciplines at academic institutions and universities as well as the downstream users in both the private sector and public administration Founded in 1926 under the former name Bildmessung und Luftbildwesen PFG is worldwide the oldest journal on photogrammetry It is the official journal of the German Society for Photogrammetry Remote Sensing and Geoinformation DGPF and welcomes the submission of English and German language articles Information on the society can be found at httpwwwdgpfde Provides a wideranging coverage of photogrammetry remote sensing and geoinformation issues since 1926 Offers fullcolor for all illustrations in its print and electronic version without charge to the authors Official journal of the German Society for Photogrammetry Remote Sensing and Geoinformation DGPF
PMC Physics A;PMC Physics A Particle and Nuclear Physics Astrophysics and Astroparticles Cosmology;
PMC Physics B;PMC Physics B Atomic Molecular Optical and Plasma Physics Condensed Matter Physics;
PROSPECTS;PROSPECTS Education general International and Comparative Education;Prospects provides comparative and international perspectives on key current issues in curriculum learning and assessment The principal features of the journal are the innovative and critical insights it offers into the equitable provision of quality and relevant education for all and the crossdisciplinary perspectives it engages drawing on a range of domains that include culture development economics ethics gender inclusion politics sociology sustainability and education Prospects aims to influence a wide range of actors in the field of education and development whether academics policymakers curriculumdevelopers assessors teachers or students Unlike other journals in the field which deal only with theoretical or researchrelated aspects Prospects also focuses on policy implementation and aims at improving the extent and effectiveness of communication between theorists and researchers on one side and policy makers and practitioners on the other The journal thus welcomes innovative empirical research case studies of policy and practice conceptual analyses and policy evaluations as well as critical analyses of published research and existing policy Founded in 1970 and published in English by Springer Prospects is among the most wellestablished journals in the field Editions in Arabic and Mandarin Chinese are available as well The journal is edited by the International Bureau of Education IBE in Geneva A leading UNESCO Institute and a global center of excellence in curriculum and related matters the IBE is recognized and valued for the specialist knowledge and expertise that it brings to Member States promoting new shared global understanding of curriculum teaching learning and assessment
PSN;PSN Psychiatry Neuropsychology Psychopharmacology Psychotherapy Psychoanalysis Behavioral Therapy;
Pacific Journal of Mathematics for Industry;Pacific Journal of Mathematics for Industry Applications of Mathematics Quantitative Finance Mathematical Applications in Computer Science Mathematical Applications in the Physical Sciences Mathematical Modeling and Industrial Mathematics Math Applications in Computer Science;
Paddy and Water Environment;Paddy and Water Environment Agriculture HydrologyWater Resources Hydrogeology GeoecologyNatural Processes Ecotoxicology Soil Science Conservation;The journal Paddy and Water Environment aims to advance the science and technology of water and environmentrelated disciplines in paddyfarming The scope extends broadly to paddyfarming related scientific and technological aspects of agricultural engineering such as irrigation and drainage soil and water conservation land and water resources management irrigation facilities and disaster management paddy multifunctionality agricultural policy regional planning bioenvironmental systems and ecological conservation and restoration in paddy farming regions Paddy and Water Environment is the official journal of the International Society of Paddy and Water Environment Engineering PAWEES httppaweesnet Dedicated to science and technology of water and environmentrelated disciplines in paddyfarming Coverage includes irrigation and drainage soil and water conservation land and water resources management irrigation facilities and disaster management and more Official journal of the International Society of Paddy and Water Environment Engineering PAWEES
Pain and Therapy;Pain and Therapy Internal Medicine Pain Medicine;Pain and Therapy is an international open access peerreviewed rapid publication journal dedicated to the publication of highquality clinical all phases observational realworld and health outcomes research around the discovery development and use of pain therapies and painrelated devices Studies relating to diagnosis pharmacoeconomics public health quality of life and patient care management and education are also encouraged Key features Rapid publication The journal aims for a 2week peer review 34 weeks from acceptance to online Open access All articles published open access CCBYNC Inclusivity All scientifically sound research considered be it positive confirmatory or negative data Research is considered from preclinical clinical phase realworld and health economics outcomes studies Submissions are welcomed whether they relate to an international or a countryspecific audience Personal service The journals team will reformat articles and upload submissions on behalf of authors if necessary Digital Features and Plain Language Summaries These peerreviewed features are welcomed to help enhance the educational value of a manuscript for more information see Author Information Guidelines for digital features and plain language summaries under Submission guidelines For examples of digital features please visit httpsspringerhealthcarecomexpertisepublishingdigitalfeatures Publication fees Upon acceptance of an article authors will be required to pay the mandatory Rapid Service Fee of 550068504700 The journal will consider fee discounts and waivers for developing countries and this is decided on a case by case basis If you would like to request a discount or waiver please do so either ahead of submission or at the very start of the submission process Requests made after this stage will not be considered Contact For more information about the journal including presubmission enquiries please contact Lucy Holt at lucyholtspringercom Research on the discovery development and use of pain therapies and painrelated devices Rapid publication and personal point of contact throughout Maximum visibility with open access
PalZ;PalZ Paleontology;Founded in 1913 PalZ Palontologische Zeitschrift is one of the journals with the longest tradition in the field of palaeontology to be published by a professional palaeontological society the Palontologische Gesellschaft The journal is dedicated to the promotion of palaeontology as a scientific discipline and publishes highquality research and review papers on all aspects of this field
Paladyn;Paladyn Artificial Intelligence Robotics and Automation Behavioral Sciences;
Palaeobiodiversity and Palaeoenvironments;Palaeobiodiversity and Palaeoenvironments Paleontology Biodiversity Animal SystematicsTaxonomyBiogeography Plant SystematicsTaxonomyBiogeography Freshwater Marine Ecology;Palaeobiodiversity and Palaeoenvironments is an international journal providing a multidisciplinary approach in the fields of Palaeobiodiversity Palaeoenvironments and Palaeobiogeography in Earth History It is a relaunch of the wellknown Senckenbergiana lethaea and incorporates peerreviewed original research review papers and short notes spanning a broad scope of subject matter Its principal fields of interest are biodiversity of fossil organisms and their palaeoenvironment comparison of modern and ancient sedimentary environments palaeoecology and palaeobiogeography Coverage includes systematic studies of all fossil animal plant groups with a special focus on palaeoenvironmental investigations palaeoecosystems and climate changes in Earths history environmentorganism interaction comparison of modern and ancient sedimentary environments palaeoecology and palaeobiogeography Please note The journal uses software to screen submitted manuscripts for plagiarism Why publish in Paleobiodiversity and Palaeoenvironments The journals diverse and international editorial board includes representation across many subspecialties of research The journal welcomes authors to collaborate and contribute to special topical collections and supplements for consideration PBPE is the official journal of the Senckenberg Institute and welcomes original submissions from all regions of the world The journal is pleased to announce that its 2021 impact factor is 1736 and it is ranked in two Clarivate categories Biodiversity Conservation and Paleontology
Paleontological Journal;Paleontological Journal Paleontology;Paleontological Journal is an international peerreviewed journal that publishes original work on the anatomy morphology and taxonomy of fossil organisms as well as their distribution ecology and origin It also publishes studies on the evolution of organisms ecosystems and the biosphere and provides information on global biostratigraphy with an emphasis on Eastern Europe and Asia The journal welcomes manuscripts from all countries PEER REVIEW Paleontological Journal is a peer reviewed journal We use a double blind peer review format The average period from submission to first decision is 30 days The average rejection rate for submitted manuscripts is 35 The final decision on the acceptance of an article for publication is made by the EditorinChief Any invited reviewer who feels unqualified or unable to review the manuscript due to the conflict of interests should promptly notify the editors and decline the invitation Reviewers should formulate their statements clearly in a sound and reasoned way so that authors can use reviewers arguments to improve the manuscript Personal criticism of the authors must be avoided Reviewers should indicate in a review i any relevant published work that has not been cited by the authors ii anything that has been reported in previous publications and not given appropriate reference or citation ii any substantial similarity or overlap with any other manuscript published or unpublished of which they have personal knowledge Presents original work on the anatomy morphology and taxonomy of fossil organisms Also explores the distribution ecology and origin of fossils Presents studies on evolution of organisms ecosystems and biosphere along with invaluable information on biostratigraphy Places emphasis on Eastern Europe and Asia
Pallium;Pallium Nursing Quality of Life Research Health Psychology;Pallium volgt de medische en verpleegkundige ontwikkelingen op het gebied van palliatieve zorg Daarbij is de praktijk de belangrijkste leidraad Hoewel de ontwikkelingen in Nederland en Vlaanderen vooral betrekking hebben op de zorg voor stervenden streeft de redactie ernaar een breder spectrum van palliatieve zorgverlening te beschrijven Pallium is bestemd voor huisartsen verpleeghuisartsen en verpleegkundigen maar heeft ook aan medisch specialisten maatschappelijk werkers vrijwilligers paramedici en psychologen veel te bieden
Papers in Regional Science;Papers in Regional Science RegionalSpatial Science Geography general;
Parasites Vectors;Parasites Vectors Parasitology Entomology Tropical Medicine Infectious Diseases Veterinary MedicineVeterinary Science Virology;
Parasitology Research;Parasitology Research Medical Microbiology Microbiology Immunology;The journal Parasitology Research covers the latest developments in parasitology across a variety of disciplines including biology medicine and veterinary medicine Among many topics discussed are chemotherapy and control of parasitic disease and the relationship of host and parasite Other coverage includes Protozoology Helminthology Entomology Morphology incl Pathomorphology Ultrastructure Biochemistry Physiology including Molecular Biology ParasiteHostRelationships including Immunology and Host Specificity Life History Ecology and Epidemiology and Diagnosis Chemotherapy and Control of Parasitic Diseases Takes a thorough wideranging view of parasites and their mechanisms of operation Covers a range of related fields Examines use of chemotherapy in treatment of parasitic diseases 99 of authors who answered a survey reported that they would definitely publish or probably publish in the journal again
Partial Differential Equations and Applications;Partial Differential Equations and Applications Partial Differential Equations Analysis Numerical Analysis Theoretical Mathematical and Computational Physics Mathematical and Computational Engineering Mathematical and Computational Biology;Partial Differential Equations and Applications PDEA offers a single platform for all PDEbased research bridging the areas of Mathematical Analysis Computational Mathematics and applications of Mathematics in the Sciences It thus encourages and amplifies the transfer of knowledge between scientists with different backgrounds and from different disciplines who study solve or apply the same types of equations PDEA accepts both original research as well as review articles of high quality providing thorough and fast peerreview The journal is organized in three sections Theory of PDEs Covering topics in elliptic parabolic and hyperbolic PDEs PDEs on manifolds fractional PDEs calculus of variations functional analysis ODEs and a range of further topics from Mathematical Analysis Computational approaches to PDEs Covering all areas in Numerical Analysis and Computational Mathematics with relation to PDEs Here the main emphasis is on the numerical method rather than the particular application Applications of PDEs in the sciences Covering applications in Mathematical Physics Chemistry Biology Engineering and also in the Life and SocialSciences Both analytic and computational methods are welcome As a bridge between the different communities the journal further invites dedicated Knowledge Transfer Papers These may be interdisciplinary review papers highlighting different perspectives on the same type of equation discussions of open problems and challenges in one community inviting research activity from another and reviews of recent results written for nonexperts amplifying the dissemination of knowledge PDEA offers Topical Collections designed to consolidate publications of a specific research topic Articles can be either released as direct papers or within a Topical Collection
Particle and Fibre Toxicology;Particle and Fibre Toxicology PharmacologyToxicology PneumologyRespiratory System Nanotechnology Public Health Environmental Health;
Pastoral Psychology;Pastoral Psychology Clinical Psychology Religious Studies general Cross Cultural Psychology Sociology general;Pastoral Psychology founded in 1950 is one of the most wellestablished and respected journals in the field of psychology and religionspirituality Pastoral Psychology is an international forum that publishes scholarly peerreviewed original articles that address varied aspects of religion and spirituality from physical human science and interfaith perspectives Historically the word pastoral has referred to the care of individuals families and communities Today we additionally consider pastoral in terms of lived experience as it relates to embodiment the socialpolitical economic spiritual and environmental dimensions of life All theoretical perspectives are welcome as Pastoral Psychology regularly publishes articles from a variety of schools of thought including but not limited to psychoanalytic and other dynamic psychologies cognitive psychologies experimental and empirical psychologies humanistic psychology transpersonal psychology and cultural psychology Insights from existential perspectives intersectional theories philosophical and theological theories gender and queer studies sociology anthropology public mental health and cultural and empirical studies are welcome Theoretical contributions that have direct or indirect relevance for practice broadly construed are especially desirable as our intended audience includes not only academics and scholars in religion and science but also religious and spiritual leaders as well as caregivers chaplains social workers counselorstherapists clinical psychologists psychiatrists and persons interested in matters of religionspirituality and psychology Pastoral Psychology welcomes scholarship and reflection from all religious and spiritual traditions In addition to scholarly research papers the journal welcomes thoughtful essays on a wide range of issues and various genres of writing including book reviews and film reviews The community of scholars represented in its pages has demonstrated that the life challenges the journal seeks to address are universally shared yet also reflect individual social cultural and religious locations The journal therefore welcomes submissions from scholars from around the world Relates psychological and behavioral science research with the work of pastoral ministry Examines the practice of pastoral care and counseling through diverse religious and psychological perspectives
Pastoralism;Pastoralism Environmental Management Anthropology Ecosystems Sustainable Development Applied Ecology Agriculture;
PathoGenetics;PathoGenetics Human Genetics Cell Biology;
Pathology Oncology Research;Pathology Oncology Research Cancer Research Oncology Pathology Immunology Biomedicine general;
Patient Safety in Surgery;Patient Safety in Surgery Surgery;
Pattern Analysis and Applications;Pattern Analysis and Applications Pattern Recognition;This journal presents original research that describes novel pattern analysis techniques as well as industrial and medical applications It details new technology and methods for pattern recognition and analysis in applied domains including computer vision and image processing speech analysis robotics multimedia document analysis character recognition knowledge engineering for pattern recognition fractal analysis and intelligent control Pattern Analysis and Applications PAA also examines the use of advanced methods including statistical techniques neural networks genetic algorithms fuzzy pattern recognition machine learning and hardware implementations which are either relevant to the development of pattern analysis as a research area or detail novel pattern analysis applications The journal contains casestudies as well as reviews on benchmarks evaluations of tools and important research activities at international centers of excellence For all submissionrelated enquiries please contact the Journal Editorial Office via Contacts or the Senior Editor Dragos Calitoiu at calitoiumathcarletonca Describes novel pattern analysis techniques as well as industrial and medical applications Details new technology and methods for pattern recognition and analysis in applied domains Examines the use of advanced methods Contains casestudies as well as reviews on benchmarks evaluations of tools and important research activities at international centers of excellence
Pattern Recognition and Image Analysis;Pattern Recognition and Image Analysis Pattern Recognition Image Processing and Computer Vision;Pattern Recognition and Image Analysis is an international peerreviewed journal that publish the results of fundamental and applied scientific research in the field of image processing recognition analysis and understanding pattern recognition artificial intelligence and related fields of theoretical and applied computer science and applied mathematics The policy of the journal provides for the rapid publication of original scientific articles analytical reviews articles of the worlds leading scientists and specialists on the subject of the journal solicited by the editorial board special thematic issues proceedings of the worlds leading scientific conferences and seminars as well as short reports containing new results of fundamental and applied research in the field of mathematical theory and methodology of image analysis mathematical theory and methodology of image recognition and mathematical foundations and methodology of artificial intelligence The journal also publishes articles on the use of the apparatus and methods of the mathematical theory of image analysis and the mathematical theory of image recognition for the development of new information technologies and their supporting software and algorithmic complexes and systems for solving complex and particularly important applied problems The main scientific areas are the mathematical theory of image analysis and the mathematical theory of pattern recognition The journal also embraces the problems of analyzing and evaluating poorly formalized poorly structured incomplete contradictory and noisy information including artificial intelligence bioinformatics medical informatics data mining big data analysis machine vision data representation and modeling data and knowledge extraction from images machine learning forecasting machine graphics databases knowledge bases medical and technical diagnostics neural networks specialized software specialized computational architectures for information analysis and evaluation linguistic psychological psychophysical and physiological aspects of image analysis and pattern recognition applied problems and related problems Pattern Recognition and Image Analysis is a hybrid journal that publishes mostly subscription articles that are free of charge for the authors but also accepts Open Access articles with article processing charges The journal is one of the top ten global periodicals on image analysis and pattern recognition and is the only publication on this topic in Central and Eastern Europe The journal welcomes manuscripts from all countries PEER REVIEW Pattern Recognition and Image Analysis is the journal in which all articles are peer reviewed We use a single blind peer review format The final decision on the publication of the manuscript is made by the EditorinChief together with the Deputy EditorsinChief and if necessary together with other members of the editorial board Any invited reviewer who feels unqualified or unable to review the manuscript due to the conflict of interests should promptly notify the editors and decline the invitation Reviewers should formulate their statements clearly in a sound and reasoned way so that authors can use reviewers arguments to improve the manuscript Personal criticism of the authors must be avoided Reviewers should indicate in a review i any relevant published work that has not been cited by the authors ii anything that has been reported in previous publications and not given appropriate reference or citation ii any substantial similarity or overlap with any other manuscript published or unpublished of which they have personal knowledge Features top papers in pattern recognition image recognition analysis understanding and processing Places emphasis on the rapid publishing of concise articles covering theory methodology and practical applications Editorial Board is headed by Yuri Zhuravlev a prominent Russian mathematician and Full Member of the Russian Academy of Sciences
Pediatric Cardiology;Pediatric Cardiology Cardiology Cardiac Surgery Vascular Surgery;The editor of Pediatric Cardiology welcomes original manuscripts concerning all aspects of heart disease in infants children adolescents and adults including embryology and anatomy physiology and pharmacology biochemistry pathology genetics radiology clinical aspects investigative cardiology electrophysiology echocardiography interventional cardiology and cardiac surgery Articles which may include original articles review articles letters to the editor etc must be written in English and must be submitted solely to Pediatric Cardiology 100 of authors who answered a survey reported that they would definitely publish or probably publish in the journal again
