Electrocatalysis;Electrocatalysis Electrochemistry Physical Chemistry Catalysis Energy Systems;Electrocatalysis is crossdisciplinary in nature and attracts the interest of chemists physicists biochemists surface and materials scientists and engineers Electrocatalysis provides the unique international forum solely dedicated to the exchange of novel ideas in electrocatalysis for academic government and industrial researchers Quick publication of new results concepts and inventions made involving Electrocatalysis stimulates scientific discoveries and breakthroughs promotes the scientific and engineering concepts that are critical to the development of novel electrochemical technologies Electrocatalysis publishes original submissions in the form of letters research papers review articles book reviews and educational papers Letters are preliminary reports that communicate new and important findings Regular research papers are complete reports of new results and their analysis and discussion Review articles critically and constructively examine development in areas of electrocatalysis that are of broad interest and importance Educational papers discuss important concepts whose understanding is vital to advances in theoretical and experimental aspects of electrochemical reactions Electrocatalysis invites submissions in subject areas including but not limited to theoretical and experimental aspects of the mechanisms and kinetics of electrochemical reactions electrochemical generation of gases electrochemical reactions in fuel cells electrosynthesis organic electrochemistry and electrocatalytic hydrogenation electrochemical reactions taking place at matrixsupported electrocatalysts electrode reactions occurring in electrochemical sensors electrochemical degradation of pollutants The EditorinChief Associate Editors and Referees rigorously review submissions to ensure that the journal maintains the highest levels of originality integrity and international readership The only forum devoted solely to Electrocatalysis Speed of publication provides a good alternative to the assorted journals where electrocatalysis is currently published Balanced mixture of rapid communications research papers perspectives and review articles
Electrochemical Energy Reviews;Electrochemical Energy Reviews Electrochemistry Renewable and Green Energy Industrial ChemistryChemical Engineering Catalysis;Electrochemical Energy Reviews EER is administrated by Shanghai University and the International Academy of Electrochemical Energy Science IAOEES It is the flagship review journal of IAOEES publishing only the highest quality scientific review articles at the forefront of Advanced Materials for Electrochemical Energy Science and Technology The editors welcome contributions on a variety of topics including Fuel cells Batteries Supercapacitors Hydrogen generation and storage CO 2 conversion Fundamental electrochemistry Electrochemical nanomaterials Electrochemical energy industry Reviews should be of the very highest quality and of international relevance We particularly welcome and encourage international and multidisciplinary collaborations among our authors Before submission or drafting the whole manuscripts please make sure to submit your proposal firstly to the editorial board though email EERproposaloashueducn and get the positive feedback from the editorial board The first international Englishlanguage review journal that focuses on electrochemical energy Publishes review articles of the very highest quality and international relevance Editorial board composed of internationally renowned experts Doubleblind anonymous review system
Electronic Commerce Research;Electronic Commerce Research IT in Business Data Structures and Information Theory Operations ResearchDecision Theory Computer Communication Networks Business and Management general eCommerceebusiness;Electronic Commerce Research serves as a catalyst for new research and a forum for disseminating the latest findings in all facets of electronic commerce The journals broad scope encompasses core enabling technologies as well as the implications of these technologies for societies economies businesses and individuals Readers will find a host of important theoretical and empirical research findings that are leading the way to a better understanding of electronic commerce and its impact A sampling of topics as they relate to the internet and electronic commerce include intelligent agents technologies and their impact economics of electronic commerce virtual electronic commerce systems service creation and provisioning supply chain management through the internet collaborative learning gaming and work and workflow for electronic commerce applications In addition to its regular issues the journal publishes periodic issues devoted to a single subject area Officially cited as Electron Commer Res Serves as a forum for disseminating the latest findings in all facets of electronic commerce Explores core enabling technologies as well as the implications of these technologies Publishes theoretical and empirical research findings that build a better understanding of electronic commerce Features periodic issues devoted to a single subject area
Electronic Markets;Electronic Markets IT in Business eCommerceebusiness;First journal to report on the developments and trends in electronic commerce embraces the entire range of electronic market issues multidisciplinary journal with an interest in the relationship between information technologies new forms of commerce and social change
Electronic Materials Letters;Electronic Materials Letters Optical and Electronic Materials Condensed Matter Physics Nanotechnology and Microengineering Characterization and Evaluation of Materials Nanotechnology;The journal Electronic Materials Letters publishes original papers and occasional critical reviews on all aspects of research and technology in electronic materials Topics include electronic magnetic photonic and nanoscale materials The editors place emphasis on science technology and applications of materials especially on the relationships among the processing and structure of various materials and their mechanical thermal chemical electrical electronic electrochemical magnetic and optical properties Coverage of processing includes thin film nanostructure fabrication selfassembly solidification phase transformation and bulk as well as related topics in thermodynamics kinetics and modeling Electronic Materials Letters is an official journal of the Korean Institute of Metals and Materials Covers all aspects of research and technology in electronic materials Emphasizes science engineering properties synthesis processing and applications Official journal of the Korean Institute of Metals and Materials
Elemente der Mathematik;Elemente der Mathematik Mathematics general;
Emergency Cancer Care;Emergency Cancer Care Emergency Medicine Oncology Intensive Critical Care Medicine;
Emergency Radiology;Emergency Radiology Imaging Radiology Emergency Medicine;Emergency Radiology informs its readers about the radiologic aspects of emergency care The journal acts as a resource body on emergency radiology for those interested in emergency patient care Emergency Radiology is the Journal of the American Society of Emergency Radiology ASER ASER members receive the journal as a benefit of Membership Journal of the American Society of Emergency Radiology ASER Official Journal of the Society for Emergency Radiology India Official Journal of the Nordic Forum for Trauma and Emergency Radiology NORDTER Official Journal of the Japanese Society of Emergency Radiology JSER 89 of authors who answered a survey rated the overall publishing process as excellent or good
Emergent Materials;Emergent Materials Materials Science general Materials Engineering Energy Materials;Emergent Materials aims to publish a series of high quality and high impact research articles that reflect and bring the best research at the forefront of physics chemistry biology and engineering of advanced materials to the international research community
Emerging Themes in Epidemiology;Emerging Themes in Epidemiology Epidemiology Public Health Research Methodology Statistics for Life Sciences Medicine Health Sciences;
Emission Control Science and Technology;Emission Control Science and Technology Environmental Science and Engineering Industrial ChemistryChemical Engineering Surfaces and Interfaces Thin Films;New submission system for Emission Control Science and Technology This journal has moved to our new editorial submission system SNAPP Do not submit new articles via the former Editorial Manager site Only manuscripts already submitted revisions are being handled in Editorial Manager Emission Control Science and Technology is a forum for publication of the latest research on control of emissions from mobile and stationary sources Papers are also welcome on various aspects of development and technology The investigation may be experimental theoretical or computational Articles must survive rigorous peer review before they are considered for publication Examples of topics that may appear in the journal include Emission control in mobile road land sea air and stationary eg power generation industrial processes applications Materials for and formulations of novel substrates and catalysts such as those used in Diesel Oxidation Catalyst DOC Three Way Catalysts TWC Diesel Particulate Filters DPF Selective Catalytic Reduction SCR Lean NOx Trap LNT combined catalysts eg DPFSCR or DPFLNT in one substrate slip catalysts or reformer catalysts Performance of emission control system components such as sensors injectors for fuel and reducing species exhaust inserts and mixers etc Effects of operational parameters eg flow temperature species concentration and design approaches sizing layout insulation etc on regulated and unregulated emissions and emission control system efficiency and performance Basic and applied research on specific components eg nanoparticles N2O and other nonregulated pollutants of emissions and their mitigation System considerations such as engineout to tailpipe efficiency optimization PGM management and formation of secondary species Studies on CO2 or other greenhouse gases such as N2O from combustion or noncombustion sources Strategies or mitigations to control reduce utilize or manage Engines combustion fuels or lubricants as they would affect emission reduction technologies or post combustion processes Testing durability and compliance such as cycles certification aging NVH infield onvehicle performance and analysis and inuse compliance Analysis of current and future emission regulations including those in the developing world Biological and environmental effects of emission control technologies The only forum devoted solely to Emission Control Science and Technology Competing publications are either in a different area catalysis or environmental science or are not peerreviewed Balanced mixture of rapid communications research papers and review articles Broad appeal market includes industry government and academia
Empirica;Empirica European Integration International Economics MacroeconomicsMonetary EconomicsFinancial Economics Econometrics Industrial Organization Public Economics;Empirica is a peerreviewed journal which publishes original research of general interest to an international audience Authors are invited to submit empirical papers in all areas of economics with a particular focus on European economies Per January 2021 the editors also solicit descriptive papers on current or unexplored topics Founded in 1974 Empirica is the official journal of the Nationalkonomische Gesellschaft Austrian Economic Association and is published in cooperation with Austrian Institute of Economic Research WIFO The journal aims at a wide international audience and invites submissions from economists around the world Officially cited as Empirica Examines problems of European economic integration theoretically and empirically Encompasses all aspects of micro market structure gametheoretic approaches and macro issues of European economics in particular related to the development of the European Union Deals with international and national economic issues relevant to the process of economic integration in Europe Sponsored by the Austrian Economic Association and the Austrian Institute of Economic Research
Empirical Economics;Empirical Economics Econometrics Statistics for Business Management Economics Finance Insurance Economic TheoryQuantitative EconomicsMathematical Methods;Empirical Economics publishes high quality papers using econometric or statistical methods to fill the gap between economic theory and observed data Papers explore such topics as estimation of established relationships between economic variables testing of hypotheses derived from economic theory treatment effect estimation policy evaluation simulation forecasting as well as econometric methods and measurement Empirical Economics emphasizes the replicability of empirical results Replication studies of important results in the literature both positive and negative results may be published as short papers in Empirical Economics Authors of all accepted papers and replications are required to submit all data and codes prior to publication for more details see Instructions for Authors The journal follows a single blind review procedure In order to ensure the high quality of the journal and an efficient editorial process a substantial number of submissions that have very poor chances of receiving positive reviews are routinely rejected without sending the papers for review Officially cited as Empir Econ Journal Impact Factor 2021 2647 Factor RePEc 937 January 2023 Rank 219 of 2883 journals listed in RePEc Addresses the gap between economic theory and observed data derived from econometric methods Emphasizes the reproducibility of empirical results publishing replication studies that report on both positive and negative results An Author is expected to provide datasets for readers who wish to replicate an authors results
Empirical Research in Vocational Education and Training;Empirical Research in Vocational Education and Training Professional and Vocational Education Labor Economics Organizational Studies Economic Sociology;
Empirical Software Engineering;Empirical Software Engineering Software EngineeringProgramming and Operating Systems Programming Languages Compilers Interpreters;COVID19 and Software Engineering EMSE is now receiving submissions relating to topics on COVID19 See Journal Updates above Empirical Software Engineering provides a forum for applied software engineering research with a strong empirical component and a venue for publishing empirical results relevant to both researchers and practitioners Empirical studies presented here usually involve the collection and analysis of data and experience that can be used to characterize evaluate and reveal relationships between software development deliverables practices and technologies Over time it is expected that such empirical results will form a body of knowledge leading to widely accepted and wellformed theories The journal also offers industrial experience reports detailing the application of software technologies processes methods or tools and their effectiveness in industrial settings Empirical Software Engineering promotes the publication of industryrelevant research to address the significant gap between research and practice A forum for applied software engineering research with a strong empirical component A venue for empirical results relevant to both researchers and practitioners Offers industrial experience reports detailing the application of software technologies Addresses the gap between research and practice
Employee Responsibilities and Rights Journal;Employee Responsibilities and Rights Journal Social Sciences general Private International Law International Foreign Law Comparative Law Ethics;Employee Responsibilities and Rights Journal fosters development of the field of employee relations by presenting highquality peerreviewed original research articles and by linking practitioner concerns involving the employment relationship with academic rigor The journal is interdisciplinary in focus drawing from a broad range of disciplines including ethics organizational behavior law economics sociology social psychology industrial and employment relations administrative and organizational studies and philosophy to further the understanding of both employee responsibilities and rights The journal offers an international forum for the publication of scholarly peerreviewed original research including qualitative and quantitative empirical studies case studies critical commentaries and conceptual and dialectic presentations In addition Employee Responsibilities and Rights Journal publishes a Perspectives Section that showcases important contributions in formats other than the traditional research article Such contributions include symposiaroundtable discussions commentaries review essays interviews and book reviews Explores and examines the everchanging balance of rights and responsibilities between employer and employee Draws on a broad range of disciplines Employs a variety of research methods and approaches Encourages solid research linked to practical application Features a Perspectives Section comprising incisive commentary and discussion
Endocrine;Endocrine Endocrinology Diabetes Internal Medicine Science Humanities and Social Sciences multidisciplinary;Wellestablished as a major journal in todays rapidly advancing experimental and clinical research Endocrine publishes fulllength original articles devoted to basic including molecular cellular and physiological studies translational and clinical including proof of concept studies and clinical trials research in all the different fields of endocrinology and metabolism Endocrine covers the following leading topics in Endocrinology such as Neuroendocrinology Pituitary and hypothalamic peptides thyroid physiological and clinical aspects bone and mineral metabolism and osteoporosis obesity lipid and energy metabolism and food intake control insulin type 1 and type 2 diabetes hormones of male and female reproduction and of HPA axis pediatric and geriatric endocrinology endocrine hypertension and endocrine oncology Covers leading topics in endocrinology Includes Hormones of reproduction metabolism growth and ion balance Offers the latest on insulin and diabetes Presents newlyemerging endocrinerelated topics 94 of authors who answered a survey reported that they would definitely publish or probably publish in the journal again
Endocrine Pathology;Endocrine Pathology Pathology Endocrinology Oncology;Endocrine Pathology publishes refereed original articles on clinical and basic aspects of endocrine disorders focusing on the diagnostic aspects of endocrine pathology Coverage includes book reviews clinical case presentations and descriptions of techniques Particular attention is paid to new developments in the diagnostic applications of molecular biology and immunohistochemistry Endocrine Pathology is the official journal of the Endocrine Pathology Society 100 of authors who answered a survey reported that they would definitely publish or probably publish in the journal again
Energy Efficiency;Energy Efficiency Energy Policy Economics and Management Renewable and Green Energy Environmental Economics Environment general Sustainable Development Energy Efficiency;Energy Efficiency covers wideranging topics related to energy efficiency energy savings energy consumption energy sufficiency and energy transition in all sectors across the globe Coverage includes energy efficiency policies at all levels of governance enabling social organizational and economic factors of sufficient and efficient behavior and decisions analysis and modeling of energy efficiency performance measures policies outcomes and impacts energy management systems and energy services the role of energy efficiency and demandside management in energy planning energy markets and risk assessment local sustainable energy planning energy behavior acceptability of policy technology and new energy systems and emerging technologies and approaches to improve energy efficiency Energy Efficiency editors welcome new and original work that contributes to our knowledge of energy efficiency and energy savings and that offers broad implications for energy efficiency within the transition to a more sustainable energy system Editors will only consider clearly written broadly applicable and accessible submissions that contain a novel element issue approach method or result and that inspire progress in actual energy efficiency gains and energy savings Areas of current interest include Evaluation and modeling of energy efficiency policies and demandside management programs Impact of energy efficiency economywide across diverse levels of governance Contribution of energy efficiency to climate change mitigation goals Cobenefits or multiple benefits of energy efficiency and energy savings especially health benefits and productivity Policies and incentives for energy efficiency and demandside management programs in future electricity markets with high shares of renewables and prosumers Innovative approaches to improving energy use by applying new business models and latest advances in digital information and communications technology Effects of behavioral approaches and social practices to energy demand and efficiency Corporate energy efficiency and energy savings management programs investment decisions financing energy efficiency and energy savings as corporate social responsibility Energy efficiency in transport buildings and communities showing the benefits of an integrated approach The role of energy efficiency and demandside response in the energy transition Energy Efficiency Presents best practices and opportunities from all corners of the world Applies multidisciplinary approaches and multiple methods Integrates fundamental and applied research Focuses on outcomes and impacts Addresses and integrates technological economic behavioral and policy communities Offers highquality original papers brief communications review articles and editorials Presents best practices and opportunities from all corners of the world Applies multidisciplinary approaches and multiple methods Integrates fundamental and applied research Focuses on outcomes and impacts Addresses and integrates technological economic behavioral and policy communities Offers highquality original papers brief communications review articles and editorials
Energy Informatics;Energy Informatics Information Systems and Communication Service;
Energy Systems;Energy Systems Energy Policy Economics and Management Operations ResearchDecision Theory Optimization Energy Systems;The journal Energy Systems presents mathematical programming control and economic approaches towards energy systems related topics and is especially relevant in light of the major worldwide challenges confronting humanity in this century Papers published in Energy Systems deal with theoretical computational and applied aspects of energy systems as well as state of the art review papers The range of coverage includes power systems optimization unit commitment power generation power trading electricity risk management competition in electricity markets bidding strategies as well as market power issues The text includes mathematical theory and algorithms for stochastic optimization methods applied to energy problems as well as modeling issues such as process optimization synthesis design and operation Energy Systems deals with an extremely topical and important field there are many new research activities going on in energy related topics Covers topics from power systems optimization to electricity risk management and bidding strategies Presents mathematical theory and algorithms for stochastic optimization methods applied to energy problems Covers modeling issues such as process optimization synthesis design and operation Combines scientists from engineering operations research and applied mathematics
Energy Transitions;Energy Transitions Energy Policy Economics and Management Sustainable Development R DTechnology Policy;
Energy Ecology and Environment;Energy Ecology and Environment Energy general Environment general Ecology;This journal offers a disciplinespanning forum for investigating shortages of natural resources impacts on ecosystems and deterioration of the natural environment Its coverage is focused on approaches that integrate considerations of energy ecology and environment and that utilize its cross disciplinary integration to function as a needed counterbalance to the dominant economic approach The journal fosters close links among these interrelated areas of investigation to set up systems science based on knowledge from other sciences and to promote multidisciplinary solutions for tackling complex socioeconomic and environmental problems Topics covered include energy economics life cycle assessment carbon capture storage and sequestration sustainable energy production and consumption and more A publication of the Joint Center on Global Change and Earth System Science of the University of Maryland and Beijing Normal University The journal has been accepted for Scopus indexing the CiteScore 2019 is 35 Emphasizes integrated disciplinespanning approaches to global natural resource challenges Covers energy economics life cycle assessment carbon capture storage and sequestration and much more A publication of the Joint Center on Global Change and Earth System Science of the University of Maryland and Beijing Normal University
