Environmental Science and Pollution Research;Environmental Science and Pollution Research Environment general Environmental Chemistry Ecotoxicology Environmental Health Atmospheric ProtectionAir Quality ControlAir Pollution Waste Water Technology Water Pollution Control Water Management Aquatic Pollution;Environmental Science and Pollution Research ESPR serves the international community in all areas of Environmental Science and related subjects with emphasis on chemical compounds It reports from a broad interdisciplinary outlook Apart from the strictly scientific contributions as research articles short and full papers and reviews ESPR publishes news views from research and technology legislation and regulation hardware and software education literature institutions organizations conferences Editorial Policy For maximum benefit to the environmental community the journal has the following features ESPR represents the international perspective with emphasis on the natural sciences but also includes the impacts of legislation regulation and the economy on pollution control and ESPR articles are generally chemically oriented but cover all the broad areas within environmental science ESPR was conceived as a truly international scientific journal Information from ESPR should also be useful for planning lectures and university environmental curricula A global network of editorial board members represents a variety of disciplines and groups of interest university industry administrative bodies government consulting companies public interest groups The Editorial Board safeguards the international and interdisciplinary character of the journal and ensures appropriate refereeing procedures peer review Why publish with us We are the official publication of the EuCheMS Division of Chemistry and the Environment DCE Our journal covers all areas of Environmental Science and related subjects with emphasis on chemical compounds Through Springer Compact agreements authors from participating institutions can publish Open Choice at no cost to the authors We deliver high levels of author satisfaction with 94 of our published authors reporting that they would definitely or probably publish with us again
Environmental Sciences Europe;Environmental Sciences Europe Environment general Pollution general Ecotoxicology;
Environmental Sustainability;Environmental Sustainability Sustainable Development Environment general Environmental Management Climate Change Natural Resources;Environmental Sustainability is a multidisciplinary quarterly peer reviewed journal focused at maintaining and sustaining the quality of our planet through biological and ecofriendly methods The journal will cover original research articles short communication reviews mini reviews and scientific opinionscommentaries in the field of Environmental Science Microbiology Biotechnology Biochemistry and Agriculture Sciences which report findings related to sustenance and remediation of ecosystems The journal will target contemporary issues such as biodegradation bioremediation reclamation of barren stress systems combating climate change green fuels sustainable agriculture organic food production etc This journal is published by Society for Environmental Sustainability Society website can be accessed here httpsesindiaorg
Environmental Systems Research;Environmental Systems Research MonitoringEnvironmental Analysis;
Environmental and Ecological Statistics;Environmental and Ecological Statistics Ecology Statistics for Engineering Physics Computer Science Chemistry and Earth Sciences Math Appl in Environmental Science Statistics for Life Sciences Medicine Health Sciences Theoretical EcologyStatistics;Environmental and Ecological Statistics broadly covers theory and methods case studies and applications environmental change and statistical ecology environmental health statistics and stochastics and related areas Special features include invited discussion papers research communications technical notes and consultation corner minireviews letters to the Editor news views and announcements hardware and software reviews data management etc Founding EditorinChief Ganapati P Patil Pennsylvania State University University Park PA USA Presents research on practical applications of statistics to environmental science Aims to advance statistics for environment ecology and environmental health and advance environmental theory and practice using valid statistics Covers theory and methods case studies and applications statistical ecology health statistics and stochastics and more
Environmental and Resource Economics;Environmental and Resource Economics Environmental Economics Environmental LawPolicyEcojustice Economic Policy Economics general Environmental Management;The primary concern of Environmental Resource Economics is the application of economic theory and methods to environmental issues and problems that require detailed analysis in order to improve management strategies The contemporary environmental debate is in a constant state of flux with new or relatively unexplored topics continually emerging The Journal provides a forum for the further exploration of causes consequences and policy responses linked to these topics across a range of spatial and temporal scales up to the global dimension Areas of particular interest include evaluation and development of instruments of environmental policy costbenefit and cost effectiveness analysis sectoral environmental policy impact analysis modeling and simulation institutional arrangements resource pricing and the valuation of environmental goods and indicators of environmental quality The contents are chosen for their relevance to the process of policy formulation and application The journal seeks to publish papers which develop and apply new theory and methods for the application of economic principles to aid local to global decisionmaking in environmental protection natural resource utilisation and ecosystem management 100 of authors who answered a survey reported that they would definitely publish or probably publish in the journal again
Epidemiologic Perspectives Innovations;Epidemiologic Perspectives Innovations Epidemiology;
Epigenetics Chromatin;Epigenetics Chromatin Animal Genetics and Genomics Human Genetics Plant Genetics and Genomics Cell Biology Gene Expression Gene Function;
Epigenetics Communications;Epigenetics Communications Human Genetics Gene Function;
Epileptic Disorders;Epileptic Disorders Neurology Neurobiology Neuropsychology Neuroradiology;
Erkenntnis;Erkenntnis Philosophy general Epistemology Ontology Ethics Logic;Erkenntnis is a philosophical journal publishing papers committed in one way or another to the philosophical attitude which is signified by the label scientific philosophy It concentrates on those philosophical fields which are particularly inspired by this attitude although other topics are welcome as well These fields are Epistemology Philosophy of science foundations and methodology of science in general and of natural and human sciences such as physics biology psychology economics social sciences in particular Philosophy of mathematics Logic philosophy of logic and all kinds of philosophical logics Philosophy of language Ontology metaphysics theory of modality Philosophical psychology philosophy of mind neurophilosophy Practical philosophy ie ethics philosophy of action philosophy of law etc One of the objectives of Erkenntnis is the provision of a suitable platform for the discussion of controversial issues another is the provision of timely competent reviews of important publications in an evergrowing field of research In recent years philosophers standing quite outside the pale of analytic philosophy have also paid careful and indeed most welcome attention to precision of concept and language to arguments and to wellgrounded foundations Erkenntnis provides for them and for philosophers of all persuasions a place of meeting of discussion and of disputation Erkenntnis was originally founded in 1930 by Rudolf Carnap and Hans Reichenbach it was revived in 1975 by Carl G Hempel Wolfang Stegmller and Wilhelm K Essler You can find more information about this in the article Hempel The old and the new Erkenntnis accessible in the tabs to the right Today Erkenntnis is one of the leading journals in philosophy worldwide and attracts firstclass authors at all stages of career from young philosophers at the PhD level up to established academic philosophers and highly renowned senior scholars
Ernhrung Wissenschaft und Praxis;Ernhrung Wissenschaft und Praxis Nutrition Food Science;
ErwerbsObstbau;ErwerbsObstbau Agriculture Plant Sciences;Das internationale Fachjournal fr den weltweiten Erwerbsobstbau Behandelt wirtschaftliche wichtige Obstarten wie Apfel Erdbeere und Skirsche aber auch andere Obstarten sowie Wildobstarten Wesentliche Zielsetzung der Zeitschrift ist die Darstellung anwendungsorientierter Forschungsergebnisse fr Wissenschaft und Praxis Die fhrende Fachzeitschrift fr Akademiker Berater und Praktiker im Obstbau Prsentiert originelle Forschungsarbeiten mit zahlreichen Abbildungen Diagrammen und Tabellen Berichte ber die Ergebnisse internationaler Verffentlichungen zum Obstbau Enthlt bersichtsartikel und die neuesten technischen Informationen
Erziehungswissenschaft;Erziehungswissenschaft Social Sciences general Psychotherapy and Counseling Pedagogic Psychology;
Esophagus;Esophagus Gastroenterology Thoracic Surgery Surgical Oncology;Esophagus the official journal of the Japan Esophageal Society introduces practitioners and researchers to significant studies in the fields of benign and malignant diseases of the esophagus The journal welcomes original articles review articles and short articles including technical notes How I do it which will be peerreviewed by the editorial board Letters to the editor are also welcome Special articles on esophageal diseases will be provided by the editorial board and proceedings of symposia and workshops will be included in special issues for the Annual Congress of the Society
Estuaries and Coasts;Estuaries and Coasts Environment general Ecology Freshwater Marine Ecology Environmental Management Coastal Sciences Water and Health;Estuaries and Coasts is the journal of the Coastal and Estuarine Research Federation Begun in 1960 as Chesapeake Science the journal gradually expanded its scope and circulation and became Estuaries in 1978 Today the journal publishes manuscripts on ecosystems at the interface between the land and the sea covering aspects of research on physical chemical geological or biological systems as well as applications to management of those ecosystems The interface is broadly defined to include estuaries and nearshore coastal waters including lagoons wetlands tidal rivers shorelands and beaches The journal publishes original research findings reviews and perspectives techniques comments and management applications Submissions that are primarily descriptive strongly placebased or report on development of models or new methods without detailing their applications fall outside the scope of the journal Why publish with us We are the official journal of the Coastal and Estuarine Research Federation CERF We provide high visibility and a wide readership for all articles which are available on SpringerLink with over 50 million users at more than 15000 institutions worldwide We publish scholarly manuscripts on estuarine and near coastal ecosystems with numerous special features and articles focusing on key topics Our expert editorial team delivers fast turnaround times averaging 44 days from submission to first decision
Ethical Theory and Moral Practice;Ethical Theory and Moral Practice Ethics Political Philosophy Theory of MedicineBioethics Philosophy of Medicine Ontology;Ethical Theory and Moral Practice is a doubleanonymous peerreviewed philosophical journal which aims to publish the best work produced in all fields of practical philosophy It welcomes highquality rigorous and original submissions regardless of the traditions or schools of thought from which they derive As an editorial priority however published papers should be accessible to the philosophical community at large and as free as possible of unnecessary jargon Ethical Theory and Moral Practice publishes work on ethical theories that address practical problems as well as work that presents or examines empirical findings regarding moral practices relevant for ethical theorizing The journal therefore actively seeks to promote crossfertilization across areas of practical philosophysuch as moral political legal and social philosophyand more empirical disciplines such as medicine economics sociology political science and psychology It welcomes work in applied ethics provided that it can offer theoretical or normative contributions to larger philosophical debates The journal also considers historicallyoriented contributions provided they are not mainly exegetical and can offer insights for current debates in practical philosophy The journal endorses the BPA SWIPUK Good Practice for Journals Further details are available in our Review Policy document
Ethics and Information Technology;Ethics and Information Technology Management of Computing and Information Systems InnovationTechnology Management Ethics User Interfaces and Human Computer Interaction Library Science;Ethics and Information Technology is a peerreviewed journal dedicated to advancing the dialogue between moral philosophy and the field of information and communication technology ICT The journal aims to foster and promote reflection and analysis which is intended to make a constructive contribution to answering the ethical social and political questions associated with the adoption use and development of ICT Within the scope of the journal are also conceptual analysis and discussion of ethical ICT issues which arise in the context of technology assessment cultural studies public policy analysis and public administration cognitive science social and anthropological studies in technology masscommunication and legal studies In addition the journal features research that deals with the history of ideas and provides intellectual resources for moral and political reflection on ICT Advances the dialogue between moral philosophy and the field of information and communication technology ICT Examines the ethical social and political questions associated with the adoption use and development of ICT Addresses issues that arise in the context of technology assessment cultural studies public policy analysis and public administration cognitive science social and anthropological studies in technology masscommunication and legal studies
Ethik in der Medizin;Ethik in der Medizin MedicinePublic Health general Gynecology Intensive Critical Care Medicine Psychotherapy Reproductive Medicine;Die Zeitschrift Ethik in der Medizin widmet sich der interdisziplinren wissenschaftlichen Erforschung und Vermittlung von Ethik in der Medizin in allen Anwendungsbereichen Verffentlicht werden Original und bersichtsarbeiten Fallbeispiele und Kommentare aktuelle Informationen und Kontroversen sowie Rezensionen Ethik in der Medizin dient sowohl dem grundstzlichen ethischen Diskurs als auch der Frderung des praktischen Entscheidungsverhaltens im medizinischen Alltag
Euphytica;Euphytica Plant Sciences Plant Genetics and Genomics Plant Pathology Plant Physiology Biotechnology;Euphytica is an international journal covering the theoretical and applied aspects of plant breeding and publishing critical reviews and papers on original research The journal reports on the growing field of research associated with the integration of modern and traditional plant breeding using transgenic crop plants andor marker assisted breeding in combination with traditional breeding tools The content addresses the interests of researchers involved in plant breeding at universities breeding institutes seed industries plant biotech companies and industries using plant raw materials and promoting stability adaptability and sustainability in agriculture and agroindustries The EditorinChief of Euphytica is RGF Visser Laboratory of Plant Breeding Wageningen University The Netherlands Peer review is conducted using Editorial Manager supported by a database of international experts This database is shared with two other journals American Journal of Potato Research and Potato Research Covers theoretical and applied aspects of plant breeding Publishes critical reviews and papers on original research Addresses the interests of researchers in academic research and business settings EditorinChief RGF Visser Laboratory of Plant Breeding Wageningen University The Netherlands 98 of authors who answered a survey reported that they would definitely publish or probably publish in the journal again
Eurasian Business Review;Eurasian Business Review Business and Management general InnovationTechnology Management Entrepreneurship Emerging MarketsGlobalization;The Eurasian Business Review EABR publishes articles in Industrial Organization Innovation and Management Science In particular EABR is committed to publishing empirical articles which provide significant contributions in the fields of the economics and management of innovation industrial and business economics corporate governance and corporate finance entrepreneurship and organizational change strategic management accounting marketing human resources management and information systems While the main focus of EABR is on Europe and Asia papers in the fields listed above on any region or country are highly encouraged EABR is listed in the Social Science Citation Index SSCI and in Scopus Impact Factor 3574 2nd quartile 2021 CiteScore 58 1 st quartile 2021 The Eurasian Business Review is one of the two official journals of the Eurasia Business and Economics Society EBES and is published quarterly An official journal of the Eurasia Business and Economics Society Publishes evidencebased research articles in Management Science and Applied Economics Features rigorous quantitative analyses and advanced empirical methodologies Publishes Position Articles written by topscholars in a field highlighting the challenges and future avenues of research concerning a particular topic within a field
Eurasian Economic Review;Eurasian Economic Review Economics general;Eurasian Economic Review EAER publishes concise research on finance and applied macroeconomics The journal has a broad scope addressing such issues as financial systems and regulation corporate and startup finance macro and sustainable finance finance and innovation consumer finance public policies on financial markets within local regional national and international contexts money and banking and the interface of labor and financial economics The macroeconomics coverage includes topics from monetary economics labor economics international economics and development economics preferably but not exclusively with a link to finance While the main focus of EAER is on Europe and Asia all papers from related fields on any region or country are highly encouraged EAER publishes both theoretical and empirical papers Typically articles published in Eurasian Economic Review highlight the economic political and societal relevance of research results EAER is listed in the Emerging Sources Citation Index ESCI and in Scopus CiteScore 2021 40 1 st quartile Eurasian Economic Review is one of two official journals of the Eurasia Business and Economics Society EBES and is published quarterly An official journal of the Eurasia Business and Economics Society EBES Examines research on all areas of finance and applied macroeconomics and encourages rigorous quantitative analyses and advanced empirical methodologies Addresses topics including macro finance monetary economics labor economics financial markets international economics development economics startup finance etc Features research on emerging fields such as green and digital finance the interaction of labor and capital markets and the impact of finance and monetary policy on the distribution of wealth
Eurasian Soil Science;Eurasian Soil Science Geotechnical Engineering Applied Earth Sciences;Eurasian Soil Science is an international peerreviewed journal that publishes original articles on global and regional theoretical and experimental studies of the genesis geography physics chemistry biology fertility management conservation and remediation of soils The journal welcomes manuscripts from all countries PEER REVIEW Eurasian Soil Science is a peer reviewed journal We use a single blind peer review format Our team of reviewers includes over 290 external experts The average period from submission to first decision is 30 days The average rejection rate for submitted manuscripts is 54 The final decision on the acceptance of an article for publication is made by the Editorial Board Any invited reviewer who feels unqualified or unable to review the manuscript due to the conflict of interests should promptly notify the editors and decline the invitation Reviewers should formulate their statements clearly in a sound and reasoned way so that authors can use reviewers arguments to improve the manuscript Personal criticism of the authors must be avoided Reviewers should indicate in a review i any relevant published work that has not been cited by the authors ii anything that has been reported in previous publications and not given appropriate reference or citation ii any substantial similarity or overlap with any other manuscript published or unpublished of which they have personal knowledge Publishes original research papers on global and regional studies Discusses problems of genesis geography physics chemistry biology fertility management conservation and remediation of soils Includes a special section devoted to the history of soil sciences Relates current news of the International and Russian soil science societies Published for the Russian Academy of Sciences
EuroMediterranean Journal for Environmental Integration;EuroMediterranean Journal for Environmental Integration Environmental Science and Engineering Waste Water Technology Water Pollution Control Water Management Aquatic Pollution Environmental Management Atmospheric ProtectionAir Quality ControlAir Pollution Waste ManagementWaste Technology Environmental Chemistry;EuroMediterranean Journal for Environmental Integration indexed in Web of Science and Scopus presents original research studies and reviews on topics spanning all areas of environmental sciences The main focus is on innovative approaches that contribute to achieving a sustainable environment in the Mediterranean and surrounding regions The journal establishes a scientific forum which promotes the exchange of knowledge and fosters collaboration between the countries of the northern and southern shores of the Mediterranean on emerging environmental issues The journal promotes environmental integration by highlighting to decision makers from related sectors the importance of integrating environmental considerations into their respective activities Coverage includes approaches and methods for environmentally sustainable innovation environmental risk assessment bioremediation ecotoxicology water quality management management of natural resources renewable energy waste valorisation and management sustainable marine and coastal area management geo and natural hazards such as earthquakes landslides and others geotechnical geoenvironmental engineering remote sensing GIS for geoenvironmental investigations the impact of natural and social environments on human health and other topics Presents original research reviews and letters Covers all areas of environmental sciences Offers innovative approaches toward a sustainable environment Promotes environmental integration Presents original research reviews and letters Covers all areas of Environmental Sciences Offers innovative approaches toward a sustainable environment Promotes environmental integration
