European Journal of Epidemiology;European Journal of Epidemiology Epidemiology Public Health Infectious Diseases Cardiology Oncology;European Journal of Epidemiology published for the first time in 1985 serves as a forum on epidemiology in the broadest sense It is a peerreviewed journal dedicated to all fields of epidemiologic research and to epidemiologic and statistical methods EJE promotes communication among those engaged in research teaching and application of epidemiology including those who practice clinical or community medicine The Journal encourages contributions from a wide variety of fields including public health preventive medicine clinical medicine health economics and computational biology and data science applied to health and disease EJE publishes empirical research findings methodological developments and opinion articles from as broad a geographical origin as possible with some focus but certainly not exclusive on European topics of relevance for epidemiology Why publish with us We are a leading journal providing a multidisciplinary forum on epidemiology for an audience of policy makers clinicians and educators Our renowned editorial team offers expert early guidance for researchers helping transform their ideas into discoveries As a high impact patform for your research we are ranked 9th out of 193 public health journals in the JCR Science Citation Index Expanded
European Journal of Forest Research;European Journal of Forest Research Forestry Plant Sciences Plant Ecology;The European Journal of Forest Research is an international scientific Journal that intends to contribute to a holistic understanding of the principles governing forest ecosystems as well as their functions and services for society The journal thus covers a broad range of subjects from natural sciences to socioeconomics which are represented by a board of subject editors with different fields of expertise see section Editorial Board Irrespective of their specific field articles published in this journal always provide generalizable knowledge that goes beyond pure description Ernst Assmann belonged to the most influential German forest scientists in the 20st century His systemic and scaleoverarching scientific approach towards forest dynamics triggered a wealth of research lines that continue up to the present day In honor of this outstanding researcher the European Journal of Forest Research initiates the series of Ernst Assmann Reviews on Production Ecology and Quantitative Silviculture The EditorinChief is Prof Dr Hans Pretzsch Chair of Forest Growth and Yield Research Department Ecology and Ecosystem Management Technische Universitt Mnchen Germany Offers research articles and reviews addressing a range of subjects worldwide Addresses biological ecological and socioeconomic knowledge related to wood and forests Explores forest systems analysis and modeling Examines foresttowood production chain Audience includes researchers managers and policy makers
European Journal of Futures Research;European Journal of Futures Research History of Science InnovationTechnology Management Sustainable Development Political Science European Integration Demography;
European Journal of Hybrid Imaging;European Journal of Hybrid Imaging Imaging Radiology Nuclear Medicine;
European Journal of Information Systems;European Journal of Information Systems Operations ResearchDecision Theory Business and Management general Information Systems and Communication Service InnovationTechnology Management Business Information Systems;
European Journal of Law and Economics;European Journal of Law and Economics Law and Economics European Integration Public Economics Commercial Law;The European Journal of Law and Economics provides readers with highquality theoretical and empirical research in which both the legal and economic dimensions merge and combine The journal welcomes articles that promote a better understanding of legal phenomena legal decisions made by judges courts or regulatory agencies and involving economic tools Theoretical papers are welcome provided they have a strong basis in law and economics We also welcome case studies as well as empirical analyses including empirical legal studies and experimental investigations The European Journal of Law and Economics does not favor any particular topic but does have a focus on new and emerging problems European themes are particularly welcome because we feel it is important to exploit Europes considerable institutional diversity in order to build a more robust body of theory and empirical evidence However the purpose of the journal is also to showcase the diversity of law and economics approaches as supplied by an international mix of authors Drawing on the support of respected scholars from around the world who serve as consulting editors and editorial board members the Editors wish to give contributing authors the opportunity to improve their papers while also offering them a quick and efficient review process
European Journal of Mathematics;European Journal of Mathematics Algebraic Geometry;Please note this journals peer review system has changed it now uses Snapp Springer Natures Article Processing Platform See the journal updates page for more information The European Journal of Mathematics EJM is an international peerreviewed journal that publishes research papers in all fields of mathematics It also publishes researchsurvey papers intended to provide nonspecialists with insight into topics of current research in different areas of mathematics The journal invites authors from all over the world All contributions are required to meet high standards of quality and originality Coverage in EJM will include Algebra Complex Analysis Differential Equations Discrete Mathematics Functional Analysis Geometry and Topology Mathematical Logic and Foundations Number Theory Numerical Analysis and Optimization Probability and Statistics Real Analysis Topological dynamics Devoted to become a home for current mathematical research and a useful forum for discussion of future studies spanning the field
European Journal of Medical Research;European Journal of Medical Research MedicinePublic Health general Infectious Diseases Internal Medicine Surgery Oncology Biomedicine general;
European Journal of Nuclear Medicine and Molecular Imaging;European Journal of Nuclear Medicine and Molecular Imaging Nuclear Medicine Imaging Radiology Orthopedics Cardiology Oncology;Highly ranked among journals in its field the European Journal of Nuclear Medicine and Molecular Imaging provides a forum for the exchange of clinical and scientific information for the nuclear medicine community and allied professions involved in the functional metabolic and molecular investigation of disease The journal remains of primary interest to practitioners in the field of nuclear medicine but also reports on original work relating to physics dosimetry radiation biology radiochemistry and pharmacy Original material examines the field of molecular imaging probes reporter gene assays cell trafficking targeting of endogenous gene expression and antisense methodologies The Journal publishes indepth reviews of topical interest short communications controversies interesting images and letters to the Editor This is the official journal of the European Association of Nuclear Medicine EANM EANM members are entitled to access the fulltext electronic version of the journal via the societys website wwweanmorg in the restricted members area Peer review is conducted using Editorial Manager supported by a database of international experts This database is shared with the journals EJNMMI Physics EJNMMI Research EJNMMI Radiopharmacy and Chemistry and the European Journal of Hybrid Imaging EJNMMI is part of the EJNMMI journal family Further details can be found at httpswwwspringeropencompnuclearmedicine including the winners of the Annual EANM Springer Award Why publish with us As Europes leading journal in our field we welcome international submissions from the nuclear medicine community and allied professions involved in the functional metabolic and molecular investigation of disease Our coverage extends to physics dosimetry radiation biology radiochemistry and pharmacy We offer high quality peer review by experts in the field and our highly cited and downloaded articles help ensure global visibility for your work
European Journal of Nutrition;European Journal of Nutrition Nutrition;European Journal of Nutrition publishes original papers reviews and short communications in the nutritional sciences Manuscripts published in European Journal of Nutrition provide current information on the impact of nutrients and nonnutrients on immunology and inflammation gene expression metabolism chronic diseases or carcinogenesis or show a major focus on epidemiology including intervention studies with healthy subjects and with patients on biofunctionality of food and food components or the impact of diet on the environment 97 of authors who answered a survey reported that they would definitely publish or probably publish in the journal again
European Journal of Orthopaedic Surgery Traumatology;European Journal of Orthopaedic Surgery Traumatology Surgical Orthopedics Traumatic Surgery;The European Journal of Orthopaedic Surgery and Traumatology EJOST aims to publish high quality Orthopedic scientific work The objective of our journal is to disseminate meaningful impactful clinically relevant work from each and every region of the world that has the potential to change and or inform clinical practice Delivers a wide array of subjects and subspecialty within Orthopedics Suited for trainees and specialists alike Through Springer Compact agreements authors from participating institutions can publish Open Choice at no cost to the authors
European Journal of Pediatrics;European Journal of Pediatrics Pediatrics;The European Journal of Pediatrics EJPE is a leading peerreviewed medical journal which covers the entire field of pediatrics New submission system for European Journal of Pediatrics Why publish with us As one of the worlds leading publications covering all aspects of pediatrics we are internationally recognized for making important developments in the field available to a broad public readership Our journal provides a high visibility platform for your work with high level of downloads and shares across Social Media Our expert editorial team offers precise review with easy and fast publication ensuring the swift dissemination of new research and provides high levels of author satisfaction with 99 of our published authors reporting that they would definitely or probably publish with us again
European Journal of Plant Pathology;European Journal of Plant Pathology Plant Pathology Plant Sciences Ecology Agriculture Life Sciences general;The European Journal of Plant Pathology is an international journal publishing original articles in English dealing with problems in all aspects of plant pathology plantpathogen interactions both in agriculture and in natural plant populations population genetics plant disease epidemiology and disease management They should contain a novel and well formulated hypothesis or research question a sound experimental or theoretical approach and results that confirm or reject the hypothesis or answer the question Research papers should offer novel insight adding to the existing body of knowledge Types of papers not normally considered for publication include method development without demonstrated use in an experimental study routine screening of host genotypes unless there is reference to resistance mechanism or strategies for gene deployment routine screening of pesticides unless there are clear insights into mode of action and efficacy and application technology routine isolate characterisation without consideration of the wider context population genetics or use in an experimental setting in vitro only studies of pathogen antagonism and new disease reports unless there are novel taxonomic findings such as species designations Authors should clearly state in the paper the significance of the presented work and its relevance to the science in the field of plant pathology Research papers should not exceed twenty pages of printed text including tables figures and references one page of printed text approximately 600 words Journal owned by the KNPV The Royal Netherlands Society of Plant Pathology Associated with the European Foundation for Plant Pathology but with a global remit EditorinChief Professor Frank van den Bosch ADAS High Mowthorpe Malton UK An Editorial Board with representation from 16 European and nonEuropean countries Presents all aspects of plant pathology research from molecular aspects of hostpathogen interaction to epidemiology and disease management with particular emphasis on experimental approaches and also following prior discussion with the EditorinChief minireviews on topical issues Offers Special Issues on coherent themes often arising from International Conferences Covers all plant pathogenic organisms viruses and virus like organisms and their vectors procaryotes oomycetes fungi nematodes and parasitic plants 94 of authors who answered a survey reported that they would definitely publish or probably publish in the journal again
European Journal of Plastic Surgery;European Journal of Plastic Surgery Plastic Surgery;Europe has long been an area of dynamic development in plastic surgery adapting to differing cultures traditions and medical and surgical philosophies Recently these changes have been even more striking and rapid Microsurgery tissue expansion craniofacial surgery and the spinoffs of these techniques have made permanent changes in trauma the treatment of malignancy and aesthetic surgery The European Journal of Plastic Surgery creates a focal point for discussion of advances in clinical technique and in research in Europe and worldwide Topics include plastic and reconstructive surgery head and neck surgery aesthetic and craniofacial surgery microsurgery trauma and burn management Follows European and worldwide innovation in plastic surgery Creates a focal point for discussion of advances in clinical technique and in research in Europe and worldwide Covers plastic and reconstructive surgery head and neck surgery aesthetic and craniofacial surgery microsurgery trauma and burn management 100 of authors who answered a survey reported that they would definitely publish or probably publish in the journal again
European Journal of Political Research;European Journal of Political Research Political Science;
European Journal of Population;European Journal of Population Demography Sociology general Human Geography Population Economics Public Economics Methodology of the Social Sciences;The European Journal of Population aims to improve understanding of population phenomena by giving priority to work that contributes to the development of theory and method and that spans the boundaries between demography and such disciplines as sociology anthropology economics geography history political science epidemiology and other sciences contributing to public health Contributors come from around the world and the coverage includes both European and nonEuropean countries The journal addresses a broad public of researchers policy makers and others concerned with population processes and their consequences Improves understanding of population phenomena fostering development of theory and method Global contributors covers both European and non European countries Benefits researchers policy makers and others concerned with population processes
European Journal of Psychology of Education;European Journal of Psychology of Education Educational Psychology Pedagogic Psychology;The European Journal of Psychology of Education EJPE is a quarterly journal oriented toward publishing highquality papers that address the relevant psychological aspects of educational processes embedded in different institutional social and cultural contexts and which focus on diversity in terms of the participants their educational trajectories and their sociocultural contexts Authors are strongly encouraged to employ a variety of theoretical and methodological tools developed in the psychology of education in order to gain new insights by integrating different perspectives Instead of reinforcing the divisions and distances between different communities stemming from their theoretical and methodological backgrounds we would like to invite authors to engage with diverse theoretical and methodological tools in a meaningful way and to search for the new knowledge that can emerge from a combination of these tools EJPE is open to all papers reflecting findings from original psychological studies on educational processes as well as to exceptional theoretical and review papers that integrate current knowledge and chart new avenues for future research Following the assumption that engaging with diversities creates great opportunities for new knowledge the editorial team wishes to encourage in particular authors from less represented countries and regions as well as young researchers to submit their work and to keep going through the review process which can be challenging but which also presents opportunities for learning and inspiration Integrates diverse research on the psychology of education across Europe Draws from the disciplines of psychology education and sociology Features a broad scope of papers combining theoretical approaches and methodologies 93 of authors surveyed reported that they would most likely or definitely publish in the journal again
European Journal of Trauma and Emergency Surgery;European Journal of Trauma and Emergency Surgery Traumatic Surgery Surgical Orthopedics Emergency Medicine Sports Medicine Intensive Critical Care Medicine Surgery;This international Englishlanguage journal offers an interdisciplinary forum for the scientific exchange between research and hospital Coverage includes surveys and original papers on diagnostics and therapy In addition to classic orthopedic traumatology all related fields are considered critical care medicine neurotraumatology new materials tissue engineering and more The European Journal of Trauma and Emergency Surgery is the official publication of the European Society for Trauma and Emergency Surgery ESTES Incorporating the International Journal of Disaster Medicine Why publish with us As the official journal of the European Society for Trauma and Emergency Surgery we are an integral part of an active global community of leading researchers and clinicians in our field We are an interdisciplinary forum for scientific exchange and we welcome original contributions and review articles from across all related disciplines We ensure that your article can be easily discovered accessed understood used and shared maximising your impact as an author and acting as a springboard for further discovery
European Journal of Wildlife Research;European Journal of Wildlife Research Zoology Ecology Fish Wildlife Biology Management;About European Journal of Wildlife Research The European Journal of Wildlife Research focuses on all aspects of wildlife mainly tetrapod ecology and management in and outside Europe Main areas are applied wildlife ecology diseases affecting wildlife population dynamics conservation economy public health ecotoxicology management hunting pest control population genetics and the sustainable use of wildlife as a natural resource Contributions to sociocultural aspects of humanwildlife relationships and to the history and sociology of hunting will also be considered The journal accepts four types of papers Reviews Original Articles Short Communications and Methods Papers Reviews on current wildlife topics metaanalyses and papers describing or applying cuttingedge methods in wildlife research are particularly welcome The Chief Editor is Christian Gortzar IREC Ciudad Real Spain Announcing Continuous Article Publishing As of 2017 European Journal of Wildlife Research changed its publication structure from paginated issues to a consecutive publishing model Continuous Article Publishing This means that papers are published in a volumeissue immediately after acceptance The Online First queue has become obsolete and the time from submission to publication in an issue is now significantly shorter Continuous Article Publishing gives articles full citation details instantly after online publication As a further aspect of the new system articles are no longer paginated sequentially by issue Therefore every article starts with page number 1 Page numbers are not used for article citation but every article has a citation ID number called the ArticleCitationID The ArticleCitationID is replacing the page numbers in the citation line which includes the journal citation title year volume number and ArticleCitationID now Example Old Eur J Wildl Res 2016 62377393 New Eur J Wildl Res 2017 63 123 This method of citation is accepted by the Web of ScienceJournal Citation Reports ISI We feel that our authors and readers greatly benefit from this change in the publication structure of European Journal of Wildlife Research Publishes crossdisciplinary papers with clear management implications Topics include wildlife ecology diseases toxicology conservation management sustainable use of natural resources and wildlife forensics Covers sociocultural aspects of humanwildlife relationships and history and sociology of hunting 91 of authors who answered a survey reported that they would definitely publish or probably publish in the journal again
European Journal of Wood and Wood Products;European Journal of Wood and Wood Products Wood Science Technology Ceramics Glass Composites Natural Materials Manufacturing Machines Tools Processes;European Journal of Wood and Wood Products reports on original research and new developments in the field of wood and wood products and their biological chemical physical as well as mechanical and technological properties processes and uses Subjects range from roundwood to wood based products composite materials and structural applications with related jointing techniques Moreover it deals with wood as a chemical raw material source of energy as well as with interdisciplinary aspects of environmental assessment and international markets European Journal of Wood and Wood Products aims at promoting international scientific communication and transfer of new technologies from research into practice Presents research into wood and wood products Examines biological chemical physical mechanical and technological properties and wood processing and uses Coverage ranges from roundwood to wood based products composite materials and timber construction 100 of authors who answered a survey reported that they would definitely publish or probably publish in the journal again
European Journal on Criminal Policy and Research;European Journal on Criminal Policy and Research Criminology and Criminal Justice general Political Science;The European Journal on Criminal Policy and Research monitors crime trends in todays enlarged Europe and beyond The focus of its peerreviewed coverage is on understanding crime in different geographical and socioeconomic contexts on presenting innovative crime prevention policies and practices and on following legislative and institutional change Discussion includes the tradeoff between security and rights and ways to optimize the effectiveness of criminal justice systems with respect to human and civil rights Recognizing that criminal justice systems are not the only method for dealing with crime the journal also devotes attention to alternative policies and practices Its four annual issues include two thematic issues and two that are open to various contributions Covers criminal policy in todays enlarged Europe and beyond Discusses tradeoffs between security and individual rights Tracks legislative and institutional change Promotes understanding of crime in different geographical and socioeconomic contexts Devotes attention to alternative policies and practices
European Orthopaedics and Traumatology;European Orthopaedics and Traumatology Orthopedics Traumatic Surgery Conservative Orthopedics Surgical Orthopedics Sports Medicine;
European Political Science;;
European Radiology;European Radiology Imaging Radiology Diagnostic Radiology Interventional Radiology Neuroradiology Ultrasound Internal Medicine;European Radiology ER continuously updates scientific knowledge in radiology by publication of strong original articles and stateoftheart reviews written by leading radiologists A well balanced combination of review articles original papers short communications from European radiological congresses and information on society matters makes ER an indispensable source for current information in this field This is the Journal of the European Society of Radiology and the official journal of a number of societies From 20042008 supplements to European Radiology were published under its companion European Radiology Supplements ISSN 16133749 Why publish with us We are a journal of the European Society of Radiology ESR and the official publication of several other professional societies Our journal publishes original articles and stateoftheart reviews by leading radiologists plus short communications and updates on Society matters encompassing all aspects of radiology and imaging Founded 1991 we are one of the leading radiology journals worldwide
European Radiology Experimental;European Radiology Experimental Imaging Radiology Diagnostic Radiology Interventional Radiology Neuroradiology Ultrasound Internal Medicine;
European Radiology Supplements;European Radiology Supplements Imaging Radiology Diagnostic Radiology Interventional Radiology Neuroradiology Ultrasound Internal Medicine;
