EJNMMI Physics;EJNMMI Physics Nuclear Medicine Imaging Radiology Applied and Technical Physics Computational Mathematics and Numerical Analysis Engineering general;
EJNMMI Radiopharmacy and Chemistry;EJNMMI Radiopharmacy and Chemistry Nuclear Medicine Imaging Radiology Nuclear Chemistry Pharmacotherapy Molecular Medicine;
EJNMMI Research;EJNMMI Research Nuclear Medicine Imaging Radiology Orthopedics Cardiac Imaging Oncology;
EPJ Data Science;EPJ Data Science Computer Appl in Social and Behavioral Sciences Datadriven Science Modeling and Theory Building Complexity;
EPJ Nonlinear Biomedical Physics;EPJ Nonlinear Biomedical Physics Systems Biology Systems Biology Complex Systems;
EPJ Quantum Technology;EPJ Quantum Technology Quantum Physics Quantum Information Technology Spintronics Nanotechnology and Microengineering;
EPJ Techniques and Instrumentation;EPJ Techniques and Instrumentation Measurement Science and Instrumentation Atomic Molecular Optical and Plasma Physics Spectroscopy and Microscopy Biological and Medical Physics Biophysics Biomaterials Characterization and Evaluation of Materials;
EPJ direct;EPJ direct Physics general Particle and Nuclear Physics Nuclear Physics Heavy Ions Hadrons Particle Acceleration and Detection Beam Physics Nuclear Fusion AtomicMolecular Structure and Spectra;
EPMA Journal;EPMA Journal Biomedicine general MedicinePublic Health general;EPMA Journal is a journal of predictive preventive and personalized medicine PPPM The journal provides expert viewpoints and research on medical innovations and advanced healthcare using predictive diagnostics targeted preventive measures and personalized patient treatments The journal is indexed by PubMed Embase and Scopus The only journal in the field of predictive preventive and personalized medicine PPPM High visibility for your research Official journal of the European Association for Predictive Preventive Personalised Medicine
ERA Forum;ERA Forum Public International Law European Integration Political Science;ERA Forum is a quarterly legal journal published by the Academy of European Law in keeping with its mission to build understanding and promote good practice of European law Distinct aspects of European law are highlighted either by selecting one or more thematic focal points for a regular issue or by publishing a special issue Articles published in the journal are drawn primarily from the most outstanding presentations delivered at ERAs conferences The conference provides a market test ensuring the journals quality and relevance Frequently cited in other journals ERA Forum is thoroughly European from the composition of its editorial and advisory boards to the selection of its contributors Most articles are published in English however articles in French and German are also included with English summaries Officially cited as ERA Forum Advances the Academy of European Laws mission to promote understanding and good practice of European law Highlights distinct areas of European law in regular issues and special thematic issues Publishes articles drawn primarily from outstanding presentations delivered at ERAs conferences Frequently cited in other journals
EURASIP Journal on Advances in Signal Processing;EURASIP Journal on Advances in Signal Processing Signal Image and Speech Processing Quantum Information Technology Spintronics;
EURASIP Journal on Audio Speech and Music Processing;EURASIP Journal on Audio Speech and Music Processing Signal Image and Speech Processing Mathematics in Music Acoustics Engineering Acoustics;
EURASIP Journal on Bioinformatics and Systems Biology;EURASIP Journal on Bioinformatics and Systems Biology Signal Image and Speech Processing Computational BiologyBioinformatics Systems Biology Biomedical Engineering and Bioengineering;
EURASIP Journal on Embedded Systems;EURASIP Journal on Embedded Systems Signal Image and Speech Processing Circuits and Systems Control Structures and Microprogramming Electronic Circuits and Devices;
EURASIP Journal on Image and Video Processing;EURASIP Journal on Image and Video Processing Signal Image and Speech Processing Image Processing and Computer Vision Biometrics Pattern Recognition;
EURASIP Journal on Information Security;EURASIP Journal on Information Security Signal Image and Speech Processing Systems and Data Security Communications Engineering Networks Security Science and Technology;
EURASIP Journal on Wireless Communications and Networking;EURASIP Journal on Wireless Communications and Networking Signal Image and Speech Processing Communications Engineering Networks Information Systems Applications incl Internet;
EURO Journal on Computational Optimization;EURO Journal on Computational Optimization Operations ResearchDecision Theory Operations Management Operations Research Management Science Optimization;
EURO Journal on Decision Processes;EURO Journal on Decision Processes Operations ResearchDecision Theory Organization Operations Research Management Science Optimization;
EURO Journal on Transportation and Logistics;EURO Journal on Transportation and Logistics Operations ResearchDecision Theory Logistics Operations Research Management Science Optimization;
Early Childhood Education Journal;Early Childhood Education Journal Learning and Instruction Education general Sociology of Education Sociology general;Early Childhood Education Journal is a professional publication of original peerreviewed articles that reflect exemplary practices in the field of contemporary early childhood education Articles cover the social physical emotional and intellectual development of children age birth through 8 analyzing issues trends and practices from an educational perspective The journal publishes featurelength articles that skillfully blend theory research and practice descriptions of outstanding early childhood programs worldwide as well as quantitative qualitative and mixedmethods research Early Childhood Education Journal is of interest not only to classroom teachers child care providers college and university faculty and administrators but also to other professionals in psychology health care family relations and social services dedicated to the care of young children Detailed instructions for authors and a link to the online submission portal may be found online at httpswwwspringercomjournal10643 Analyzes issues trends policies and practices that shape the care and education of young children birth8 years throughout the world Publishes peerreviewed scholarly articles to address the evidencebased information needs of professionals dedicated to improving outcomes for young children and their families Has a diverse international readership that includes higher education faculty preserviceinservice teachers and professionals in related disciplines 100 of authors who answered a survey reported that they would definitely publish or probably publish in the journal again Includes practical theoretical and research articles that focus on child development young children with special needs curriculum and evaluation early childhood programs homeschool collaboration effective pedagogy professional development and child advocacy
Earth Perspectives;Earth Perspectives Earth System Sciences Biogeosciences Environmental LawPolicyEcojustice Epidemiology Water general Biodiversity;
Earth Science Informatics;Earth Science Informatics Earth Sciences general Information Systems Applications incl Internet Simulation and Modeling Ontology Space Sciences including Extraterrestrial Physics Space Exploration and Astronautics Earth System Sciences;The Earth Science Informatics ESIN journal aims at rapid publication of highquality current cuttingedge and provocative scientific work in the area of Earth Science Informatics as it relates to Earth systems science and space science This includes articles on the application of formal and computational methods computational Earth science spatial and temporal analyses and all aspects of computer applications to the acquisition storage processing interchange and visualization of data and information about the materials properties processes features and phenomena that occur at all scales and locations in the Earth systems five components atmosphere hydrosphere geosphere biosphere cryosphere and in space see About this journal for more detail The quarterly journal publishes research methodology and software articles as well as editorials comments and book and software reviews Review articles of relevant findings topics and methodologies are also considered Research Technology and Education Objectives ESIN will help to develop and shape the new field of Earth Science Informatics It is intended to provide a dissemination platform for research using systemsbased approaches to solve multiscale Earth science problems by encouraging the development of robust formal and computational models and information systems Since Earth Science Informatics is a new field just now emerging there is little precedence how to formally educate traditional domain knowledgeoriented scientists and engineers to become informaticists and also how to effectively integrate cyberinfrastructure into Earth science education The Earth Science Informatics journal will act as a venue to share experiences and concepts for educational approaches to accomplish the training of the next generation of Earth science informaticists as well as bringing cyberinfrastructure into the scholarly and graduatelevel education Rationale for the Journal Earth Science Informatics is a rapidly developing interdisciplinary field with the potential to have a significant impact on the advancement of Earth system science by deriving new knowledge about the Earth system through formal informationrich and semanticbased approaches Analysis and understanding of complex Earth phenomena and processes necessitate the integration of field experimental theoretical and computation research through informatics Information on Open Research Funding and Support may be found here httpswwwspringernaturecomgpopenresearchinstitutionalagreements If you are a corresponding author affiliated with a German university or research institution you are entitled to publish open access in our journals with fees covered by the German DEAL agreement More than 900 German institutions are eligible to participate in the agreement between Springer Nature and Projekt DEAL meaning that corresponding authors affiliated with these institutions are eligible to publish their articles open access without being invoiced by Springer Nature The agreement includes more than 2000 hybrid journals across the Springer Nature portfolio from January 2020 and more than 500 fully OA journals from August 2020 This international Englishlanguage journal publishes original interdisciplinary articles on all aspects of Earth Science Informatics including geoinformatics computational Earth science and all aspects of computer applications dealing with the Earth Systems Science ESS and planetary and space science Informatics is the science of the application of formal and computational methods to the systematic analysis management interchange and representation of spatial and temporal data information and knowledge Earth Science Informatics helps accessing integrating and processing ESS data with open extensible and interoperable computational software allowing Earth and space scientists to acquire visualize analyze and share information about the Earth and space Earth Science Informatics as a scientific discipline and the Earth Science Informatics journal that represents it focus on the following major aspects Formal representation of the spatial and temporal relationships between entities in the Earth system and space eg semantics spatial and process ontologies vocabularies Techniques for spatial and temporal analyses and their applications Design development and application of software tools to search store access query share visualize analyze and interchange data and knowledge database knowledge base Data standardization interoperability and federation solutions Emerging technologies such as the Semantic Web and their applications in Earth and space science Data life cycle data provenance stewardship archiving preservation curation versioning security confidentiality ownership authenticity quality and policy
Earth Systems and Environment;Earth Systems and Environment Earth System Sciences MonitoringEnvironmental Analysis Geography general Environmental Science and Engineering Climate general Climate ChangeClimate Change Impacts;Earth Systems and Environment indexed in Web of Science ESCI and Scopus CiteScore 85 publishes peerreviewed original research and review articles on the entire range of Earth System sciences and environmentrelated topics The journal has a multidisciplinary character focused upon a set of interrelated scientific topics intended to enhance our understanding of the interactions between various components of the Earth System eg the atmosphere oceans cryosphere land hydrosphere pedosphere lithosphere Earths inner core and the effects of global change as well as the effect of biosphere and human activities Highlights Expands knowledge of the natural workings and various processes and interactions that govern the Earth systems in response to complex environmental problems caused by natural and humaninduced forcings Coverage includes hydrosphere lithosphere and troposphere dynamics geoenvironmental hazards ecology desertification agricultural and marine sciences pollution and more The journal is associated with King Abdulaziz University Jeddah Saudi Arabia awards and remuneration for authors of the best papers
Earth Moon and Planets;Earth Moon and Planets Astronomy Observations and Techniques Planetology Space Sciences including Extraterrestrial Physics Space Exploration and Astronautics Astrophysics and Astroparticles;Earth Moon and Planets An International Journal of Solar System Science publishes original contributions relevant to understanding our solar system and the bodies within it The editorinchief welcomes proposals from guest editors for special thematic collections and is happy to discuss the suitability of potential submissions Commonly used title abbreviations Earth Moon Planets EMP EMP Publication of Color Illustrations is Free of Charge Along with your submission please include a cover letter and explain how your work fits within the remit of the journal For a full description of the topics covered in Earth Moon and Planets please see the Aims and Scope page
Earth Planets and Space;Earth Planets and Space Earth Sciences general Geology GeophysicsGeodesy;
Earthquake Engineering and Engineering Vibration;Earthquake Engineering and Engineering Vibration Geotechnical Engineering Applied Earth Sciences Civil Engineering Vibration Dynamical Systems Control;Earthquake Engineering and Engineering Vibration is an international journal sponsored by the Institute of Engineering Mechanics IEM China Earthquake Administration in cooperation with the Multidisciplinary Center for Earthquake Engineering Research MCEER and State University of New York at Buffalo It promotes scientific exchange between Chinese and foreign scientists and engineers to improve the theory and practice of earthquake hazards mitigation preparedness and recovery The journal focuses on earthquake engineering in all aspects including seismology tsunamis ground motion characteristics soil and foundation dynamics wave propagation probabilistic and deterministic methods of dynamic analysis behavior of structures and methods for earthquake resistant design and retrofit of structures that are germane to practicing engineers It includes seismic code requirements as well as supplemental energy dissipation base isolation and structural control International coverage of earthquake hazards mitigation preparedness and recovery Focuses on earthquake engineering including seismology tsunamis ground motion characteristics soil and foundation dynamics wave propagation and more Reports on methods for earthquake resistant design and retrofit of structures
Earthquake Science;Earthquake Science GeophysicsGeodesy;
East Asia;East Asia Political Science Social Sciences general;East Asia examines the interplay between the politics and culture that underlies major developments in China Japan Korea and the Pacific Rim It offers a unique transnational approach to political economic and cultural issues This international quarterly focuses on the complex and subtle influences these nations exert upon one another East Asia examines the competition assimilation and tensions that shape events in the region today and for years to come Examines the interplay between the politics and culture that underlies major developments in China Japan Korea and the Pacific Rim Focuses on the complex and subtle influences these nations exert upon one another Offers a unique transnational approach to political economic and cultural issues Formerly entitled Journal of Northeast Asian Studies
East Asian Community Review;East Asian Community Review Asian Politics Regionalism;
East Asian Science Technology and Society an International Journal;East Asian Science Technology and Society an International Journal Social Sciences general Sociology general Science Humanities and Social Sciences multidisciplinary History general;
Eastern Economic Journal;;
Eating and Weight Disorders Studies on Anorexia Bulimia and Obesity;Eating and Weight Disorders Studies on Anorexia Bulimia and Obesity Psychiatry;Eating and Weight Disorders Studies on Anorexia Bulimia and Obesity is a scientific journal whose main purpose is to create an international forum devoted to the several sectors of eating disorders and obesity and the significant relations between them The journal publishes basic research clinical and theoretical articles on eating disorders and weightrelated problems anorexia nervosa bulimia nervosa subthreshold eating disorders obesity atypical patterns of eating behaviour and body weight regulation in clinical and nonclinical populations Interdisciplinary coverage of eating disorders obesity and interrelations Official journal of the SISDCA and the SIO For psychiatrists nutritional scientists psychologists dietitians and more
Echo Research Practice;Echo Research Practice Cardiology Cardiac Imaging;
EcoHealth;EcoHealth Public Health Environmental Health Ecosystems Microbiology Animal Ecology Water and Health;An international journal at the interface of ecology health sciences and sustainability Addresses health and sustainability challenges within diverse settings ranging from public health practice and human and veterinary medicine to conservation and ecosystem management to rural and urban development and planning EditorInChief Peter Daszak EcoHealth Alliance New York USA EcoHealth aims to advance research practice and knowledge integration at the interface of ecology and health by publishing high quality research and review articles that address and profile new ideas developments and programs The journals scope encompasses research that integrates concepts and theory from many fields of scholarship including ecological social and health sciences and the humanities and draws upon multiple types of knowledge including those of relevance to practice and policy Papers address integrated ecology and health challenges arising in public health human and veterinary medicine conservation and ecosystem management rural and urban development and planning and other fields that address the socialecological context of health The journal is a central platform for fulfilling the mission of EcoHealth Alliance to strive for sustainable health of people domestic animals wildlife and ecosystems by promoting discovery understanding and transdisciplinarity The journal invites substantial contributions in the following areas One Health and Conservation Medicine Integrated research on health of humans wildlife livestock and ecosystems Research and policy in ecology public health and agricultural sustainability Emerging infectious diseases affecting people wildlife domestic animals and plants Research and practice linking human and animal health andor socialecological systems Anthropogenic environmental change and drivers of disease emergence in humans wildlife livestock and ecosystems Health of humans and animals in relation to terrestrial freshwater and marine ecosystems Ecosystem Approaches to Health Systems thinking and socialecological systems in relation to health Transdisciplinary approaches to health ecosystems and society Multistakeholder problem solving and Governance arrangements for social systems ecosystems and human health Ecosystem Sustainability and Health Gender and social equity dimensions of health in socialecological systems Knowledge to Action in ecohealth research Learning and collaboration across multiple types of knowledge and different fields of research including ecological social and health sciences and the humanities Public Health Ecosystems and Society Socialecological determinants of health inequities chronic disease and wellbeing Local and global environmental change and impacts on health ecosystems and biodiversity Ecological dynamics of and ecosystem approaches to infectious and chronic disease Relationships between development including international trade and travelecosystem sustainability poverty and health Local traditional and Indigenous knowledge of links between ecosystems and health Impacts of urbanization migration population growth and landuse change on health and ecosystems Ecosystem services for health equity and sustainability
Ecological Processes;Ecological Processes Environment general;
Ecological Research;Ecological Research Ecology Plant Sciences Zoology Evolutionary Biology Behavioral Sciences Forestry;
Economia Politica;Economia Politica Economic Policy International Political Economy;This journal publishes peerreviewed articles that link theory and analysis in political economy promoting a deeper understanding of economic realities and more effective courses of policy action Established in 1984 the journal has kept pace with the times in disseminating highquality and influential research aimed at establishing fruitful links between theories approaches and institutions With this relaunch which combines Springers worldwide scientific scope with the Italian cultural roots of il Mulino and Fondazione Edison whose research has been published by the two mentioned publishers for many years the journal further reinforces its position in the European and international economic debate and scientific community Furthermore this move increases its pluralistic attention to the role that at the micro sectoral and macro level institutions and innovation play in the unfolding of economic change at different stages of development Founded by Alberto Quadrio Curzio in 1984 since then EditorinChief of Economia Politica Published by il Mulino since 1984 and published by Springer in copublication with il Mulino as of 2015
Economic Labour Market Review;Economic Labour Market Review Economics general;
Economic Botany;Economic Botany Plant Sciences Plant SystematicsTaxonomyBiogeography Plant AnatomyDevelopment Plant Physiology Plant Ecology;SPECIAL ISSUE ETHNOBOTANY FOR THE FUTURE THEORY METHODS AND SOCIAL ENGAGEMENT See Journal Updates for submission details Interdisciplinary in scope Economic Botany bridges the gap between pure and applied botany by focusing on the uses of plants by people There are no page charges for publication in Economic Botany but current membership in the Society for Economic Botany by the corresponding author is a condition of publication If you are not currently a member your manuscript will go through the review process but it will not be approved for publication until you are a member of the Society Membership forms are available online httpswwweconbotorghomemembershipaboutmembershiphtml Economic Botany is a quarterly journal published by The New York Botanical Garden for the Society for Economic Botany The foremost publication of its kind in this field the journal documents the rich relationship between plants and people around the world encompassing the past present and potential uses of plants Each issue contains original research articles review articles book reviews annotated bibliographies and notes on economic plants Documents the rich relationship between plants and people around the world Bridges the gap between pure and applied botany by focusing on the uses of plants by people Includes original research articles review articles book reviews annotated bibliographies and notes on economic plants
Economic Bulletin;Economic Bulletin Economic Policy;
