journal_title|article_title|article_link
Qualitative Sociology|Privileged but not in Power: How Asian American Tech Workers use Racial Strategies to Deflect and Confront Race and Racism|https://link.springer.com/article/10.1007/s11133-022-09527-1
Qualitative Sociology|“Horrible Slime Stories” When Serving Victims: The Labor of Role-taking and Secondary Trauma Exposure|https://link.springer.com/article/10.1007/s11133-022-09528-0
Qualitative Sociology|“Welcome to the Revolution”: Promoting Generational Renewal in Argentina’s Ni Una Menos|https://link.springer.com/article/10.1007/s11133-023-09530-0
Qualitative Sociology|“It’s the Seeing and Feeling”: How Embodied and Conceptual Knowledges Relate in Pipeline Engineering Work|https://link.springer.com/article/10.1007/s11133-022-09520-8
Qualitative Sociology|Code Ethnography and the Materiality of Power in Internet Governance|https://link.springer.com/article/10.1007/s11133-022-09517-3
Qualitative Sociology|Diagnosis as Subculture: Subversions of Health and Medical Knowledges in the Orthorexia Recovery Community on Instagram|https://link.springer.com/article/10.1007/s11133-022-09518-2
Qualitative Sociology|Latency and Crisis: Mutual Aid Activism in the Covid-19 Pandemic|https://link.springer.com/article/10.1007/s11133-022-09513-7
Qualitative Sociology|‘It Isn't Charity because We've Paid into it’: Social Citizenship and the Moral Economy of Welfare Recipients in the Wake of 2012 UK Welfare Reform Act|https://link.springer.com/article/10.1007/s11133-021-09505-z
Qualitative Sociology|What is Qualitative in Research|https://link.springer.com/article/10.1007/s11133-021-09497-w
Qualitative Sociology|Anarchy’s Neighborhoods: the Formation of a Quadriplex Urban Ecology|https://link.springer.com/article/10.1007/s11133-021-09474-3
Qualitative Sociology|Textbooks, Postcards, and the Public Consolidation of Nationalism in Latin America|https://link.springer.com/article/10.1007/s11133-020-09467-8
Qualitative Sociology|The Archives Made Me Do It|https://link.springer.com/article/10.1007/s11133-020-09459-8
Qualitative Sociology|GangstaLife: Fusing Urban Ethnography with Netnography in Gang Studies|https://link.springer.com/article/10.1007/s11133-020-09445-0
Qualitative Sociology|Striving for Consensus: How Panels Evaluate Artistic Productions|https://link.springer.com/article/10.1007/s11133-019-09439-7
Qualitative Sociology|“For a Younger Crowd”: Place, Belonging, and Exclusion among Older Adults Facing Neighborhood Change|https://link.springer.com/article/10.1007/s11133-019-09441-z
Qualitative Sociology|Verbalizing Sensations: Making Sense of Embodied Sexual Experiences|https://link.springer.com/article/10.1007/s11133-019-09426-y
Qualitative Sociology|The Vicious Cycle in the Bolsa Família Program’s Implementation: Discretionality and the Challenge of Social Rights Consolidation in Brazil|https://link.springer.com/article/10.1007/s11133-019-09429-9
Qualitative Sociology|What is Qualitative in Qualitative Research|https://link.springer.com/article/10.1007/s11133-019-9413-7
Qualitative Sociology|Analyzing the Role of Women in Italian Mafias: the Case of the Neapolitan Camorra|https://link.springer.com/article/10.1007/s11133-018-9389-8
Qualitative Sociology|Vicarious Group Trauma among British Jews|https://link.springer.com/article/10.1007/s11133-016-9337-4
Qualitative Sociology|Silencing to Give Voice: Backstage Preparations in the Undocumented Youth Movement in Los Angeles|https://link.springer.com/article/10.1007/s11133-016-9333-8
Qualitative Sociology|Debating the Burqa in France: the Antipolitics of Islamic Revival|https://link.springer.com/article/10.1007/s11133-011-9192-2
Qualitative Sociology|A Galilean Moment in Social Theory? Language, Culture and their Emergent Properties|https://link.springer.com/article/10.1007/s11133-010-9180-y
Qualitative Sociology|“This Ain’t My School!” Criminality, Control, and Contradictions in Institutional Responses to School Truancy|https://link.springer.com/article/10.1007/s11133-010-9181-x
Qualitative Sociology|Caged Morality: Moral Worlds, Subculture, and Stratification Among Middle-Class Cage-Fighters|https://link.springer.com/article/10.1007/s11133-010-9175-8
Qualitative Sociology|The Problem of Embodiment in the Sociology of Knowledge: Afterword to the Special Issue on Knowledge in Practice|https://link.springer.com/article/10.1007/s11133-010-9173-x
Qualitative Sociology|“Public Policy is Like Having a Vaudeville Act”: Languages of Duty and Difference among Think Tank-Affiliated Policy Experts|https://link.springer.com/article/10.1007/s11133-010-9166-9
Qualitative Sociology|Beyond the Head: The Practical Work of Curating Contemporary Art|https://link.springer.com/article/10.1007/s11133-010-9164-y
Qualitative Sociology|Producing Precarity: The Temporary Staffing Agency in the Labor Market|https://link.springer.com/article/10.1007/s11133-010-9149-x
Qualitative Sociology|Importing Western Childhoods into a Chinese State-Run Orphanage|https://link.springer.com/article/10.1007/s11133-010-9151-3
Qualitative Sociology|Creating Community: Latina Nannies in a West Los Angeles Park|https://link.springer.com/article/10.1007/s11133-009-9129-1
Qualitative Sociology|“They’re Coming to America”: Immigration, Settlement, and Citizenship|https://link.springer.com/article/10.1007/s11133-009-9127-3
Qualitative Theory of Dynamical Systems|SIR Model with Vaccination: Bifurcation Analysis|https://link.springer.com/article/10.1007/s12346-023-00802-2
Qualitative Theory of Dynamical Systems|Existence of Solutions to Nonlinear Fourth-Order Beam Equation|https://link.springer.com/article/10.1007/s12346-023-00789-w
Qualitative Theory of Dynamical Systems|Phenomenology of an In-host Model of Hepatitis C|https://link.springer.com/article/10.1007/s12346-023-00790-3
Qualitative Theory of Dynamical Systems|Uncountable Family of 0-Rigid Continua that are Homeomorphic to Their Inverse Limits|https://link.springer.com/article/10.1007/s12346-023-00777-0
Qualitative Theory of Dynamical Systems|On Local and Nonlocal Discrete p-Laplacian Equations via Clark’s Theorem|https://link.springer.com/article/10.1007/s12346-023-00767-2
Qualitative Theory of Dynamical Systems|Strong Pairs of Periodic Segments|https://link.springer.com/article/10.1007/s12346-023-00771-6
Qualitative Theory of Dynamical Systems|Continuous Dependence in a Problem of Convergence of Random Iteration|https://link.springer.com/article/10.1007/s12346-023-00763-6
Qualitative Theory of Dynamical Systems|Qualitative Behaviour of Stochastic Integro-differential Equations with Random Impulses|https://link.springer.com/article/10.1007/s12346-022-00714-7
Qualitative Theory of Dynamical Systems|Exactly Solvable Quadratic Differential Equation Systems Through Generalized Inversion|https://link.springer.com/article/10.1007/s12346-023-00738-7
Qualitative Theory of Dynamical Systems|On a Certain Class of IFSs and Their Attractors|https://link.springer.com/article/10.1007/s12346-022-00688-6
Qualitative Theory of Dynamical Systems|Power Series Solutions of Non-linear q-Difference Equations and the Newton–Puiseux Polygon|https://link.springer.com/article/10.1007/s12346-022-00656-0
Qualitative Theory of Dynamical Systems|On Unbounded Motions in a Real Analytic Bouncing ball Problem|https://link.springer.com/article/10.1007/s12346-022-00644-4
Qualitative Theory of Dynamical Systems|Abelian Integrals and Non-generic Turning Points|https://link.springer.com/article/10.1007/s12346-022-00609-7
Qualitative Theory of Dynamical Systems|An Optimal Thirty-Second-Order Iterative Method for Solving Nonlinear Equations and a Conjecture|https://link.springer.com/article/10.1007/s12346-022-00572-3
Qualitative Theory of Dynamical Systems|Simultaneous Bifurcation of Limit Cycles and Critical Periods|https://link.springer.com/article/10.1007/s12346-021-00546-x
Qualitative Theory of Dynamical Systems|Truncated Local Uniformization of Formal Integrable Differential Forms|https://link.springer.com/article/10.1007/s12346-021-00549-8
Qualitative Theory of Dynamical Systems|Escaping Orbits Are also Rare in the Almost Periodic Fermi–Ulam Ping-Pong|https://link.springer.com/article/10.1007/s12346-021-00545-y
Qualitative Theory of Dynamical Systems|Compression–Expansion Fixed Point Theorems for Decomposable Maps and Applications to Discontinuous \(\phi \)-Laplacian problems|https://link.springer.com/article/10.1007/s12346-021-00505-6
Qualitative Theory of Dynamical Systems|Metric Versus Topological Receptive Entropy of Semigroup Actions|https://link.springer.com/article/10.1007/s12346-021-00485-7
Qualitative Theory of Dynamical Systems|On the existence of the Hutchinson measure for generalized iterated function systems|https://link.springer.com/article/10.1007/s12346-020-00420-2
Qualitative Theory of Dynamical Systems|On the Universal Unfolding of Vector Fields in One Variable: A Proof of Kostov’s Theorem|https://link.springer.com/article/10.1007/s12346-020-00416-y
Qualitative Theory of Dynamical Systems|Morse Index and Stability of the Planar N-vortex Problem|https://link.springer.com/article/10.1007/s12346-020-00410-4
Qualitative Theory of Dynamical Systems|Periodic Orbits and Global Stability for a Discontinuous SIR Model with Delayed Control|https://link.springer.com/article/10.1007/s12346-020-00395-0
Qualitative Theory of Dynamical Systems|Attracting and Natural Invariant Varieties for Polynomial Vector Fields and Control Systems|https://link.springer.com/article/10.1007/s12346-020-00365-6
Qualitative Theory of Dynamical Systems|On the Uniqueness of Limit Cycles in a Generalized Liénard System|https://link.springer.com/article/10.1007/s12346-019-00332-w
Qualitative Theory of Dynamical Systems|Spiderweb Central Configurations|https://link.springer.com/article/10.1007/s12346-019-00330-y
Qualitative Theory of Dynamical Systems|Periodic Points for Sphere Maps Preserving Monopole Foliations|https://link.springer.com/article/10.1007/s12346-018-0298-8
Qualitative Theory of Dynamical Systems|Stokes Phenomenon and Confluence in Non-autonomous Hamiltonian Systems|https://link.springer.com/article/10.1007/s12346-018-0269-0
Qualitative Theory of Dynamical Systems|The Center Problem for the Lotka Reactions with Generalized Mass-Action Kinetics|https://link.springer.com/article/10.1007/s12346-017-0243-2
Qualitative Theory of Dynamical Systems|Stability for a New Discrete Ratio-Dependent Predator–Prey System|https://link.springer.com/article/10.1007/s12346-017-0228-1
Qualitative Theory of Dynamical Systems|Limit Sets, Attractors and Chaos|https://link.springer.com/article/10.1007/s12346-015-0163-y
Qualitative Theory of Dynamical Systems|Some Results About Global Asymptotic Stability|https://link.springer.com/article/10.1007/s12346-013-0102-8
Qualitative Theory of Dynamical Systems|Bifurcations in Hamiltonian Systems with a Reflecting Symmetry|https://link.springer.com/article/10.1007/s12346-012-0075-z
Qualitative Theory of Dynamical Systems|Transitive Lie Algebras of Vector Fields: An Overview|https://link.springer.com/article/10.1007/s12346-011-0062-9
Qualitative Theory of Dynamical Systems|Invariant Torus in 3D Lotka–Volterra Systems Appearing After Perturbation of Hopf Center|https://link.springer.com/article/10.1007/s12346-011-0037-x
Qualitative Theory of Dynamical Systems|Focal Values of Plane Cubic Centers|https://link.springer.com/article/10.1007/s12346-010-0031-8
Quality & Quantity|Adding a constant to the variables in the regression through the origin: the effect on the uncentered \(R^2\)|https://link.springer.com/article/10.1007/s11135-022-01495-6
Quality & Quantity|Modelling geographical variations in fertility and population density of Italian and foreign populations at the local scale: a spatial Durbin approach for Italy (2002–2018)|https://link.springer.com/article/10.1007/s11135-022-01446-1
Quality & Quantity|Differences in measurement quality depending on recall: results for a question about trust in the parliament|https://link.springer.com/article/10.1007/s11135-022-01441-6
Quality & Quantity|A text data mining approach to the study of emotions triggered by new advertising formats during the COVID-19 pandemic|https://link.springer.com/article/10.1007/s11135-022-01460-3
Quality & Quantity|Mixed frequency composite indicators for measuring public sentiment in the EU|https://link.springer.com/article/10.1007/s11135-022-01468-9
Quality & Quantity|Does context matter? Exploring the effects of productive structures on the relationship between innovation and workforce skills’ complementarity|https://link.springer.com/article/10.1007/s11135-022-01438-1
Quality & Quantity|Measures of state capacity: so similar, yet so different|https://link.springer.com/article/10.1007/s11135-022-01466-x
Quality & Quantity|Improving quality of the scanner CPI: proposition of new multilateral methods|https://link.springer.com/article/10.1007/s11135-022-01506-6
Quality & Quantity|Exploring food security as a multidimensional topic: twenty years of scientific publications and recent developments|https://link.springer.com/article/10.1007/s11135-022-01452-3
Quality & Quantity|Perceived influence of COVID-19 pandemic on university students' learning and mental health in Ethiopia|https://link.springer.com/article/10.1007/s11135-022-01485-8
Quality & Quantity|Two-sample test for ambivalent subset relationship in fuzzy set qualitative comparative analysis|https://link.springer.com/article/10.1007/s11135-023-01687-8
Quality & Quantity|Estimating fuzzy measures of deprivation at local level in Tuscany|https://link.springer.com/article/10.1007/s11135-023-01679-8
Quality & Quantity|A network model for multiple selection questions in opinion surveys|https://link.springer.com/article/10.1007/s11135-023-01680-1
Quality & Quantity|Skills, availability, willingness, expected participation and burden of sharing visual data within the frame of web surveys|https://link.springer.com/article/10.1007/s11135-023-01670-3
Quality & Quantity|Occam’s razor, machine learning and stochastic modeling of complex systems: the case of the Italian energy market|https://link.springer.com/article/10.1007/s11135-023-01681-0
Quality & Quantity|Measuring human mobility in times of trouble: an investigation of the mobility of European populations during COVID-19 using big data|https://link.springer.com/article/10.1007/s11135-023-01678-9
Quality & Quantity|Revisiting policy combinations under IS–LM–EE framework introducing capacity utilization|https://link.springer.com/article/10.1007/s11135-023-01676-x
Quality & Quantity|Charting fields and spaces quantitatively: from multiple correspondence analysis to categorical principal components analysis|https://link.springer.com/article/10.1007/s11135-023-01669-w
Quality & Quantity|Impact of COVID-19 on elderly population well-being: evidence from European countries|https://link.springer.com/article/10.1007/s11135-023-01656-1
Quality & Quantity|The emergence of social soft skill needs in the post COVID-19 era|https://link.springer.com/article/10.1007/s11135-023-01659-y
Quality & Quantity|Using web archives for an explorative study of the web presence of German parties during the European election 2019|https://link.springer.com/article/10.1007/s11135-023-01654-3
Quality & Quantity|What are teacher relational skills? A defining study using a bottom-up modified Delphi method|https://link.springer.com/article/10.1007/s11135-023-01638-3
Quality & Quantity|Panel data and descriptor for energy econometrics – an efficiency, resilience and innovation analysis|https://link.springer.com/article/10.1007/s11135-022-01420-x
Quality & Quantity|The role of party preferences in explaining acceptance of freedom restrictions in a pandemic context: the Italian case|https://link.springer.com/article/10.1007/s11135-022-01436-3
Quality & Quantity|Pandemetrics: systematically assessing, monitoring, and controlling the evolution of a pandemic|https://link.springer.com/article/10.1007/s11135-022-01424-7
Quality & Quantity|A correlation study of sustainable development goal (SDG) interactions|https://link.springer.com/article/10.1007/s11135-022-01443-4
Quality & Quantity|How does Internationalisation affect the productivity of R&D activities in large innovative firms? A conditional nonparametric investigation|https://link.springer.com/article/10.1007/s11135-022-01391-z
Quality & Quantity|Who pushes the discussion on wind energy? An analysis of self-reposting behaviour on Twitter|https://link.springer.com/article/10.1007/s11135-022-01448-z
Quality & Quantity|Persistence of financial efficiency in indian hospitality and tourism industry: a dynamic panel Approach|https://link.springer.com/article/10.1007/s11135-022-01368-y
Quality & Quantity|Analyzing networks in communication: a mixed methods study of a political debate|https://link.springer.com/article/10.1007/s11135-022-01394-w
Quality & Quantity|A fuzzy-hybrid analysis of citizens’ perception toward immigrants in Europe|https://link.springer.com/article/10.1007/s11135-022-01401-0
Quality & Quantity|Sri Lankans’ residential segregation and spatial inequalities in Southern Italy: an empirical analysis using fine-scale data on regular lattice geographies|https://link.springer.com/article/10.1007/s11135-022-01434-5
Quality & Quantity|The power of online panel paradata to predict unit nonresponse and voluntary attrition in a longitudinal design|https://link.springer.com/article/10.1007/s11135-022-01385-x
Quality & Quantity|The effect of sampling mode on response rate and bias in elite surveys|https://link.springer.com/article/10.1007/s11135-022-01406-9
Quality & Quantity|Development and validation of the Remote Working Benefits & Disadvantages scale|https://link.springer.com/article/10.1007/s11135-022-01364-2
Quality & Quantity|An Options Game approach to valuate broadband projects in a smart city context|https://link.springer.com/article/10.1007/s11135-022-01428-3
Quality & Quantity|A higher-order model of community resilience potential: development and assessment through confirmatory composite analysis based on partial least squares|https://link.springer.com/article/10.1007/s11135-022-01400-1
Quality & Quantity|Disentangling (new) labour market divides: outsiders’ and globalization losers’ socio-economic risks in Europe|https://link.springer.com/article/10.1007/s11135-022-01414-9
Quality & Quantity|Politics, markets, and CEO pay: a congruence analysis of two competing theoretical explanations of executive compensation at large firms in Finland|https://link.springer.com/article/10.1007/s11135-023-01646-3
Quality & Quantity|Moral rhetoric in discrete choice models: a Natural Language Processing approach|https://link.springer.com/article/10.1007/s11135-023-01625-8
Quality & Quantity|Correction to: Should I stay or should I go: A dynamical model of musicians’ agglomeration and migration|https://link.springer.com/article/10.1007/s11135-023-01643-6
Quality & Quantity|Configurational analysis of conditions influencing customers’ channel switching intention in omnichannel retailing: a fuzzy-set analysis|https://link.springer.com/article/10.1007/s11135-023-01633-8
Quality & Quantity|Research and knowledge transfer performance in Colombian universities|https://link.springer.com/article/10.1007/s11135-023-01627-6
Quality & Quantity|Should I stay or should I go: A dynamical model of musicians’ agglomeration and migration|https://link.springer.com/article/10.1007/s11135-023-01634-7
Quality & Quantity|The impact of polarity score on real option valuation for multistage projects|https://link.springer.com/article/10.1007/s11135-023-01635-6
Quality & Quantity|Risk-adjusted geometric diversified portfolios|https://link.springer.com/article/10.1007/s11135-023-01631-w
Quality & Quantity|Seasonality and the female happiness paradox|https://link.springer.com/article/10.1007/s11135-023-01628-5
Quality & Quantity|Synthetic indicators to analyze work-related physical and psychosocial risk factors: evidence from the European Working Conditions Survey|https://link.springer.com/article/10.1007/s11135-023-01617-8
Quality & Quantity|Contextual factors influencing election results in Bosnia and Herzegovina|https://link.springer.com/article/10.1007/s11135-023-01622-x
Quality & Quantity|On pursuit and evasion game problems with Gr\(\ddot{\text {o}}\)nwall-type constraints|https://link.springer.com/article/10.1007/s11135-023-01616-9
Quality & Quantity|Why do wantrepreneurs fail to take actions? Moderators of the link between intentions and entrepreneurial actions at the early stage of venturing|https://link.springer.com/article/10.1007/s11135-022-01337-5
Quality & Quantity|Exploring polarisation in economic hardship among Italian macro-regions|https://link.springer.com/article/10.1007/s11135-022-01370-4
Quality & Quantity|Economic expectations and anxiety during the COVID-19 pandemic: a one-year longitudinal evaluation on Italian university students|https://link.springer.com/article/10.1007/s11135-022-01330-y
Quality & Quantity|Informing policy with text mining: technological change and social challenges|https://link.springer.com/article/10.1007/s11135-022-01378-w
Quality & Quantity|An analysis of intertemporal inconsistency through the hyperbolic factor|https://link.springer.com/article/10.1007/s11135-022-01352-6
Quality & Quantity|Old versus young: How much do countries spend on social benefits? Deterministic modeling for government expenditure|https://link.springer.com/article/10.1007/s11135-022-01371-3
Quality & Quantity|University leagues alongside rankings|https://link.springer.com/article/10.1007/s11135-022-01374-0
Quality & Quantity|Measuring partisan polarization with partisan differences in satisfaction with the government: the introduction of a new comparative approach|https://link.springer.com/article/10.1007/s11135-022-01350-8
Quality & Quantity|The “qualitative” in qualitative comparative analysis (QCA): research moves, case-intimacy and face-to-face interviews|https://link.springer.com/article/10.1007/s11135-022-01358-0
Quality & Quantity|The perceived seriousness of crimes: inter-individual commonalities and differences|https://link.springer.com/article/10.1007/s11135-022-01379-9
Quality & Quantity|A Move Forward: Exploring National Identity Through Non-linear Principal Component Analysis in Germany|https://link.springer.com/article/10.1007/s11135-022-01398-6
Quality & Quantity|Enlarging the divide? Per-Capita Income as a measure of social inequalities in a southern European City|https://link.springer.com/article/10.1007/s11135-022-01360-6
Quality & Quantity|Statistical methods to estimate the impact of remote teaching on university students’ performance|https://link.springer.com/article/10.1007/s11135-023-01612-z
Quality & Quantity|A Rank Graduation Accuracy measure to mitigate Artificial Intelligence risks|https://link.springer.com/article/10.1007/s11135-023-01613-y
Quality & Quantity|Sampling Twitter users for social science research: evidence from a systematic review of the literature|https://link.springer.com/article/10.1007/s11135-023-01615-w
Quality & Quantity|Evaluating the response effort and data quality of established political solidarity measures: a pre-registered experimental test in an online survey of the German adult resident population in 2021|https://link.springer.com/article/10.1007/s11135-022-01594-4
Quality & Quantity|Quantifying the cost of quality in construction projects: an insight into the base of the iceberg|https://link.springer.com/article/10.1007/s11135-022-01574-8
Quality & Quantity|Cash transfers and female labor supply—how public policy matters? A bibliometric analysis of research patterns|https://link.springer.com/article/10.1007/s11135-022-01609-0
Quality & Quantity|Is there a growing use of mobile devices in web surveys? Evidence from 128 web surveys in Germany|https://link.springer.com/article/10.1007/s11135-022-01601-8
Quality & Quantity|Looking for COVID side effects in the EU through the analysis of health and behavioural profiles|https://link.springer.com/article/10.1007/s11135-022-01606-3
Quality & Quantity|Correction to: Who is asking? The effect of survey sponsor misperception on political trust: evidence from the Afrobarometer|https://link.springer.com/article/10.1007/s11135-022-01591-7
Quality & Quantity|Correction to: Scientific production of peruvian schools of Architecture: a bibliometric study|https://link.springer.com/article/10.1007/s11135-022-01584-6
Quality & Quantity|Correction to: Assessing dissimilarity of employment history information from survey and administrative data using sequence analysis techniques|https://link.springer.com/article/10.1007/s11135-022-01375-z
Quality & Quantity|Search intensity, search time and prices: evidence from retail diesel markets in France|https://link.springer.com/article/10.1007/s11135-022-01343-7
Quality & Quantity|Mining patterns of transitional growth using multivariate concept-based models|https://link.springer.com/article/10.1007/s11135-022-01318-8
Quality & Quantity|Measuring hope: validity of short versions of four popular hope scales|https://link.springer.com/article/10.1007/s11135-022-01316-w
Quality & Quantity|COVID-19: average time from infection to death in Poland, USA, India and Germany|https://link.springer.com/article/10.1007/s11135-022-01340-w
Quality & Quantity|A psychological perspective towards understanding the objective and subjective gray zones in predatory publishing|https://link.springer.com/article/10.1007/s11135-021-01307-3
Quality & Quantity|Assessing dissimilarity of employment history information from survey and administrative data using sequence analysis techniques|https://link.springer.com/article/10.1007/s11135-022-01333-9
